,1st,2nd,3rd,4th,5th
The Gift,Message from Nam,Night Whispers,The Long Road Home,The Mulberry Tree,Montana Sky
The Girl Who Loved Tom Gordon,The Regulators,It,Rose Madder,Four Past Midnight,Dreamcatcher
The Girls' Guide to Hunting and Fishing,The Sweet Potato Queens' Book of Love,Midwives: A Novel,The Virgin Suicides,The Nanny Diaries: A Novel,Good in Bed
The Giver (21st Century Reference),"Like Water for Chocolate: A Novel in Monthly Installments With Recipes, Romances and Home Remedies",Exclusive,Bridge to Terabithia,The Temple of My Familiar,I Know Why the Caged Bird Sings
The Glass Lake,Circle of Friends,Echoes,Dark Angel,Ellen Foster,Smart Women
The God of Small Things,The English Patient,A Widow for One Year,Song of Solomon (Oprah's Book Club (Paperback)),Blessings,The Cider House Rules
"The Golden Compass (His Dark Materials, Book 1)","The Subtle Knife (His Dark Materials, Book 2)","The Amber Spyglass (His Dark Materials, Book 3)",American Gods,The Eyre Affair: A Novel,The Blind Assassin
The Great Gatsby,How to Be Good,The Catcher in the Rye,The English Patient,Angela's Ashes: A Memoir,The Joy Luck Club
The Green Mile,Skeleton Crew,It,Pet Sematary,The Dark Half,Gerald's Game
The Guardian,Purity in Death,"Key of Valor (Roberts, Nora. Key Trilogy, 3.)",The Long Road Home,The Rescue,Cry Wolf
"The Gunslinger (The Dark Tower, Book 1)","The Drawing of the Three (The Dark Tower, Book 2)",Black House,"Wizard and Glass (The Dark Tower, Book 4)",The Dark Half,Desperation
The Handmaid's Tale,Bastard Out of Carolina,A Civil Action,1984,The Kitchen God's Wife,The Red Tent (Bestselling Backlist)
The Hitchhiker's Guide to the Galaxy,The Hours : A Novel,Pet Sematary,Good Omens,I Capture the Castle,Zen and the Art of Motorcycle Maintenance: An Inquiry into Values
The Hobbit : The Enchanting Prelude to The Lord of the Rings,"The Two Towers (The Lord of the Rings, Part 2)","The Fellowship of the Ring (The Lord of the Rings, Part 1)",Where the Red Fern Grows,One for the Money (A Stephanie Plum Novel),"The Return of the King (The Lord of the Rings, Part 3)"
The Honk and Holler Opening Soon,Saint Maybe,Mother of Pearl,A Lesson Before Dying (Vintage Contemporaries (Paperback)),Wicked: The Life and Times of the Wicked Witch of the West,The Woman Next Door
The Horse Whisperer,The Loop,Drums of Autumn,The Alibi,Envy,Final Target
The Hot Zone,Chromosome 6,The Shipping News : A Novel,The Sweet Potato Queens' Book of Love,Pigs in Heaven,It Was on Fire When I Lay Down on It
The Hours : A Novel,The Hitchhiker's Guide to the Galaxy,A Thousand Acres (Ballantine Reader's Circle),The English Patient,The Bonesetter's Daughter,The Fourth Hand
The Hours: A Novel,The Dogs of Babel (Today Show Book Club #12),Blue Diary,The Temple of My Familiar,The Shipping News : A Novel,The Last Time They Met : A Novel
The House of the Spirits,You Belong To Me,Last Chance Saloon,The Lost World,The Cradle Will Fall,I'll Be Seeing You
The Hundred Secret Senses,Bridget Jones: The Edge of Reason,Seabiscuit,The Bonesetter's Daughter,The Kitchen God's Wife,A Case of Need
The Hunt for Red October,Clear and Present Danger (Jack Ryan Novels),Patriot Games (Jack Ryan Novels),Debt of Honor (Jack Ryan Novels),Absolute Power,Without Remorse
The Idiot Girls' Action Adventure Club,Last Chance Saloon,The Sweet Potato Queens' Book of Love,Me Talk Pretty One Day,A Wrinkle in Time,A Bend in the Road
The Jester,Touching Evil,Small Town Girl,The Dogs of Babel (Today Show Book Club #12),Killjoy,The Mulberry Tree
The Joy Luck Club,The Kitchen God's Wife,The Hundred Secret Senses,The Bonesetter's Daughter,The Other Boleyn Girl,The Great Gatsby
The Killing Game: Only One Can Win...and the Loser Dies,Dust to Dust,Kiss the Girls,Message from Nam,The Face of Deception,Smart Women
The King of Torts,Bleachers,"The Reptile Room (A Series of Unfortunate Events, Book 2)",Black House,Cruel &amp; Unusual (Kay Scarpetta Mysteries (Paperback)),Anne of Green Gables (Anne of Green Gables Novels (Paperback))
The Kiss,The Reef,The First Counsel,A Man Named Dave: A Story of Triumph and Forgiveness,Granny Dan,Invasion
The Kitchen God's Wife,The Bonesetter's Daughter,The Joy Luck Club,Tears of the Giraffe (No.1 Ladies Detective Agency),The Sweet Potato Queens' Book of Love,The Handmaid's Tale
The Last Precinct,Night Sins,Unnatural Exposure,Death du Jour,Cry Wolf,The Body Farm
The Last Time They Met : A Novel,The Woman Next Door,The Rapture of Canaan,The Dogs of Babel (Today Show Book Club #12),A Bend in the Road,The Reader
The Little Prince,The Poisonwood Bible,Prodigal Summer,The Celestine Prophecy (Celestine Prophecy),Anne of Avonlea (Anne of Green Gables Novels (Paperback)),Harry Potter and the Chamber of Secrets (Book 2)
The Long Road Home,Message from Nam,Exclusive,Heartbeat,Five Days in Paris,Fine Things
The Loop,The Horse Whisperer,Final Target,Postmortem,The Alchemist: A Fable About Following Your Dream,Hearts in Atlantis
The Lost World,Jurassic Park,The Sands of Time,Colony,The House of the Spirits,Jacob Have I Loved
The Lottery Winner : Alvirah And Willy Stories,Winter Moon,Call of the Wild,Hideaway,Shadowfires,Dark Rivers of the Heart
The Lovely Bones: A Novel,Where the Heart Is (Oprah's Book Club (Paperback)),Good in Bed,The Book of Ruth (Oprah's Book Club (Paperback)),Life of Pi,Lucky : A Memoir
The Mists of Avalon,Harry Potter and the Sorcerer's Stone (Book 1),Year of Wonders,Harry Potter and the Chamber of Secrets (Book 2),Dragonfly in Amber,Harry Potter and the Order of the Phoenix (Book 5)
The Most Wanted,Dark Angel,The Killing Game: Only One Can Win...and the Loser Dies,Suzanne's Diary for Nicholas,Wanderlust,Smart Women
The Mulberry Tree,"Forever... : A Novel of Good and Evil, Love and Hope",Midnight Bayou,Three Fates,Killjoy,Sanctuary
The Mummy or Ramses the Damned,The Witching Hour (Lives of the Mayfair Witches),I Capture the Castle,The Queen of the Damned (Vampire Chronicles (Paperback)),Fried Green Tomatoes at the Whistle Stop Cafe,Shadow Prey
The Murder Book,Flesh and Blood,2nd Chance,Roses Are Red (Alex Cross Novels),Isle of Dogs,To the Nines: A Stephanie Plum Novel
The Nanny Diaries: A Novel,The Devil Wears Prada : A Novel,The Hours: A Novel,The Girls' Guide to Hunting and Fishing,A Lesson Before Dying (Vintage Contemporaries (Paperback)),Shopaholic Takes Manhattan (Summer Display Opportunity)
The Next Accident,2nd Chance,Full Tilt (Janet Evanovich's Full Series),Tell No One,Hard Eight : A Stephanie Plum Novel (A Stephanie Plum Novel),To the Nines: A Stephanie Plum Novel
The No. 1 Ladies' Detective Agency (Today Show Book Club #8),Tears of the Giraffe (No.1 Ladies Detective Agency),Morality for Beautiful Girls (No.1 Ladies Detective Agency),Under the Tuscan Sun,The Crimson Petal and the White,Confessions of an Ugly Stepsister : A Novel
The Notebook,A Walk to Remember,The Rescue,One Door Away from Heaven,Toxin,The Five People You Meet in Heaven
The Other Boleyn Girl,The Eight,Second Nature,The Joy Luck Club,Girl in Hyacinth Blue,Empire Falls
The Partner,The Rainmaker,The Pelican Brief,The Street Lawyer,The Brethren,The Chamber
The Pelican Brief,The Client,The Firm,A Time to Kill,The Partner,The Rainmaker
The Perfect Storm : A True Story of Men Against the Sea,"Like Water for Chocolate: A Novel in Monthly Installments With Recipes, Romances and Home Remedies",The Reef,Seabiscuit: An American Legend,A Man Named Dave: A Story of Triumph and Forgiveness,Second Nature
The Phantom Tollbooth,A Wrinkle In Time,A Year in Provence,SHIPPING NEWS,A Wrinkle in Time,How to Make an American Quilt
The Pillars of the Earth,Drums of Autumn,Zoya,Dragonfly in Amber,The Mists of Avalon,Coraline
The Pilot's Wife : A Novel,Drowning Ruth (Oprah's Book Club),The Lovely Bones: A Novel,P Is for Peril,Little Altars Everywhere: A Novel,Range of Motion
The Plains of Passage (Earth's Children (Paperback)),The Valley of Horses,"Scarlett : The Sequel to Margaret Mitchell's \Gone With the Wind\""""",The Clan of the Cave Bear (Earth's Children (Paperback)),Dust to Dust,The First Counsel
The Poisonwood Bible,Prodigal Summer,Kiss the Girls,Postmortem,The Alienist,The Celestine Prophecy (Celestine Prophecy)
The Poisonwood Bible: A Novel,Jewel,Midnight in the Garden of Good and Evil: A Savannah Story,Empire Falls,Midwives: A Novel,Cold Sassy Tree
The Prince of Tides,Cold Mountain,Wish You Well,The Temple of My Familiar,The Hours: A Novel,Plum Island
The Princess Bride: S Morgenstern's Classic Tale of True Love and High Adventure,Rising Sun,Tears of the Giraffe (No.1 Ladies Detective Agency),Tell Me Lies (Tell Me Lies),Different Seasons,The Sweet Potato Queens' Book of Love
The Promise,Fine Things,Secrets,Daddy,Message from Nam,Kaleidoscope
The Pull of the Moon,Range of Motion,STONES FROM THE RIVER,The Deep End of the Ocean,Dr. Atkins' New Diet Revolution,Vinegar Hill (Oprah's Book Club (Paperback))
The Queen of the Damned (Vampire Chronicles (Paperback)),"The Vampire Lestat (Vampire Chronicles, Book II)",The Tale of the Body Thief (Vampire Chronicles (Paperback)),Taltos: Lives of the Mayfair Witches,Interview with the Vampire,The Witching Hour (Lives of the Mayfair Witches)
The Rainmaker,The Firm,The Chamber,The Partner,The Client,The Pelican Brief
The Rapture of Canaan,Vinegar Hill (Oprah's Book Club (Paperback)),Here on Earth,Charming Billy,The Last Time They Met : A Novel,A Map of the World
The Reader,Drowning Ruth,Jewel,A Lesson Before Dying (Vintage Contemporaries (Paperback)),The Last Time They Met : A Novel,Songs in Ordinary Time (Oprah's Book Club (Paperback))
The Red Tent (Bestselling Backlist),Girl with a Pearl Earring,The Bonesetter's Daughter,The Reader,Fried Green Tomatoes at the Whistle Stop Cafe,The Handmaid's Tale
The Reef,Heaven and Earth (Three Sisters Island Trilogy),Sacred Sins,Macgregor Brides (Macgregors),Montana Sky,Rising Tides
The Regulators,The Tommyknockers,It,Rose Madder,Four Past Midnight,The Girl Who Loved Tom Gordon
"The Reptile Room (A Series of Unfortunate Events, Book 2)","The Bad Beginning (A Series of Unfortunate Events, Book 1)",Possession : A Romance,A Walk to Remember,The Last Time They Met : A Novel,The King of Torts
The Rescue,A Walk to Remember,The Notebook,The Guardian,A Man Named Dave: A Story of Triumph and Forgiveness,The Dogs of Babel (Today Show Book Club #12)
The Return Journey,Echoes,Evening Class,Scarlet Feather,Tara Road,Angela's Ashes (MMP) : A Memoir
"The Return of the King (The Lord of the Rings, Part 3)","The Two Towers (The Lord of the Rings, Part 2)","The Fellowship of the Ring (The Lord of the Rings, Part 1)","Scarlett : The Sequel to Margaret Mitchell's \Gone With the Wind\""""",Red Storm Rising,Midnight in the Garden of Good and Evil
The Robber Bride,The Stone Diaries,A Thousand Acres (Ballantine Reader's Circle),"Dude, Where's My Country?",The Blind Assassin,Stupid White Men ...and Other Sorry Excuses for the State of the Nation!
The Runaway Jury,The Rainmaker,The Partner,The Testament,The Pelican Brief,The Street Lawyer
The Sands of Time,Message from Nam,From Potter's Field,Montana Sky,Kaleidoscope,Body of Lies
The Saving Graces: A Novel,Angela's Ashes (MMP) : A Memoir,The Secret Life of Bees,Girl in Hyacinth Blue,Tell No One,Wicked: The Life and Times of the Wicked Witch of the West
The Search,Body of Lies,Guilty as Sin,The Ugly Duckling,Night Sins,Purity in Death
The Secret Garden,Jewel (Oprah's Book Club),That Camden Summer,A Walk to Remember,GARDEN OF SHADOWS (Dollanger Saga (Paperback)),Circle of Friends
The Secret Life of Bees,Under the Tuscan Sun,Snow Falling on Cedars,Wicked: The Life and Times of the Wicked Witch of the West,The Five People You Meet in Heaven,A Painted House
The Shipping News : A Novel,The Divine Secrets of the Ya-Ya Sisterhood: A Novel,The Hours: A Novel,Exclusive,"All the Pretty Horses (The Border Trilogy, Vol 1)","Like Water for Chocolate: A Novel in Monthly Installments With Recipes, Romances and Home Remedies"
The Simple Truth,The Genesis Code,A Day Late and a Dollar Short,Harvest,Last Chance Saloon,Eyes of a Child
The Smoke Jumper,The Last Time They Met : A Novel,"Forever... : A Novel of Good and Evil, Love and Hope",The Summerhouse,The No. 1 Ladies' Detective Agency (Today Show Book Club #8),The Loop
The Stone Diaries,Falling Angels,The Robber Bride,"All the Pretty Horses (The Border Trilogy, Vol 1)",The Shipping News : A Novel,The Alienist
The Street Lawyer,The Testament,The Partner,The Chamber,The Pelican Brief,The Firm
"The Subtle Knife (His Dark Materials, Book 2)","The Amber Spyglass (His Dark Materials, Book 3)","The Golden Compass (His Dark Materials, Book 1)",The Eyre Affair: A Novel,Song of Solomon (Oprah's Book Club (Paperback)),The God of Small Things
The Sum of All Fears (Jack Ryan Novels),Executive Orders (Jack Ryan Novels),Debt of Honor (Jack Ryan Novels),Red Storm Rising,Patriot Games (Jack Ryan Novels),Clear and Present Danger (Jack Ryan Novels)
The Summerhouse,The Woman Next Door,Unspeakable,Standoff,Miss Julia Speaks Her Mind : A Novel,Heartbreaker
The Summons,The Empty Chair,Pop Goes the Weasel,Colony,The Street Lawyer,1st to Die: A Novel
The Surgeon,The Mulberry Tree,Hard Eight : A Stephanie Plum Novel (A Stephanie Plum Novel),Midnight Bayou,Seven Up (A Stephanie Plum Novel),Mercy
The Sweet Potato Queens' Book of Love,The Girls' Guide to Hunting and Fishing,The Virgin Suicides,Saving Faith,Midnight in the Garden of Good and Evil,The Kitchen God's Wife
The Switch,Night Sins,The Edge,"Key of Valor (Roberts, Nora. Key Trilogy, 3.)",Face the Fire (Three Sisters Island Trilogy),The Alibi
The Tale of the Body Thief (Vampire Chronicles (Paperback)),"The Vampire Lestat (Vampire Chronicles, Book II)",The Queen of the Damned (Vampire Chronicles (Paperback)),Interview with the Vampire,Taltos: Lives of the Mayfair Witches,The Witching Hour (Lives of the Mayfair Witches)
The Talisman,The Tommyknockers,It,The Regulators,Skeleton Crew,Desperation
The Tao of Pooh,Hearts in Atlantis,I Know This Much Is True (Oprah's Book Club),The Plains of Passage (Earth's Children (Paperback)),Harry Potter and the Sorcerer's Stone (Book 1),Winter Moon
The Temple of My Familiar,Schindler's List,The Hours: A Novel,Good Omens,"Like Water for Chocolate: A Novel in Monthly Installments With Recipes, Romances and Home Remedies",Midnight in the Garden of Good and Evil
The Testament,The Street Lawyer,Four Blind Mice,The Brethren,The Runaway Jury,The Client
The Thorn Birds,Wuthering Heights,Dances With Wolves,GARDEN OF SHADOWS (Dollanger Saga (Paperback)),River's End,Intensity
The Tommyknockers,The Regulators,Four Past Midnight,The Dark Half,It,Rose Madder
"The Two Towers (The Lord of the Rings, Part 2)","The Fellowship of the Ring (The Lord of the Rings, Part 1)","The Return of the King (The Lord of the Rings, Part 3)",Charlotte's Web (Trophy Newbery),The Hobbit : The Enchanting Prelude to The Lord of the Rings,It Was on Fire When I Lay Down on It
The Ugly Duckling,A Thin Dark Line (Mysteries &amp; Horror),Exclusive,The Face of Deception,Secrets,Eyes of a Child
The Valley of Horses,The Clan of the Cave Bear (Earth's Children (Paperback)),The Plains of Passage (Earth's Children (Paperback)),Vinegar Hill (Oprah's Book Club (Paperback)),Dust to Dust,The Empty Chair
"The Vampire Lestat (Vampire Chronicles, Book II)",The Tale of the Body Thief (Vampire Chronicles (Paperback)),The Queen of the Damned (Vampire Chronicles (Paperback)),Interview with the Vampire,The Witching Hour (Lives of the Mayfair Witches),"The Drawing of the Three (The Dark Tower, Book 2)"
The Villa,The Reef,Heaven and Earth (Three Sisters Island Trilogy),Three Fates,Purity in Death,Portrait in Death
The Virgin Suicides,A Lesson Before Dying (Vintage Contemporaries (Paperback)),The Sweet Potato Queens' Book of Love,Couplehood,The Girls' Guide to Hunting and Fishing,Fall On Your Knees (Oprah #45)
The Wedding,Nights in Rodanthe,The Jester,Skipping Christmas,The Rescue,Welcome to Temptation
The Weight of Water : A Novel Tag: Author of Resistance and Strange Fits of Passion,Seabiscuit: An American Legend,Beloved (Plume Contemporary Fiction),Nothing Lasts Forever,"The Vampire Lestat (Vampire Chronicles, Book II)",The Stone Diaries
The Winner,The Alibi,The First Counsel,Echoes,Saving Faith,The Cardinal of the Kremlin (Jack Ryan Novels)
The Witching Hour (Lives of the Mayfair Witches),"The Vampire Lestat (Vampire Chronicles, Book II)",Violin,Interview with the Vampire,The Tale of the Body Thief (Vampire Chronicles (Paperback)),The Queen of the Damned (Vampire Chronicles (Paperback))
The Witness,Secrets,Exclusive,Message from Nam,Kaleidoscope,Remember Me
The Woman Next Door,The Summerhouse,The Last Time They Met : A Novel,Fat Tuesday,"Whirlwind (Tyler, Book 1)",Last Man Standing
Thinner,The Dark Half,Misery,The Tommyknockers,Gerald's Game,Carrie
Three Fates,Heaven and Earth (Three Sisters Island Trilogy),The Reef,Midnight Bayou,The Mulberry Tree,Rising Tides
Three Junes,Plainsong (Vintage Contemporaries),Cold Mountain : A Novel,Midnight in the Garden of Good and Evil: A Savannah Story,Under the Tuscan Sun,Wicked: The Life and Times of the Wicked Witch of the West
Three To Get Deadly : A Stephanie Plum Novel (A Stephanie Plum Novel),High Five (A Stephanie Plum Novel),Seven Up (A Stephanie Plum Novel),Four To Score (A Stephanie Plum Novel),Two for the Dough,Hard Eight : A Stephanie Plum Novel (A Stephanie Plum Novel)
Timeline,A Man in Full,Sphere,The Tommyknockers,Mirror Image,If Tomorrow Comes
Tis : A Memoir,Into Thin Air : A Personal Account of the Mt. Everest Disaster,The First Counsel,The Temple of My Familiar,Don't Stand Too Close to a Naked Man,False Memory
Tis: A Memoir,Cry Wolf,Don't Stand Too Close to a Naked Man,A Great Deliverance,Death du Jour,The Catcher in the Rye
To Kill a Mockingbird,The Catcher in the Rye,Five Quarters of the Orange,Drowning Ruth,The Bean Trees,The Color of Water: A Black Man's Tribute to His White Mother
To the Nines: A Stephanie Plum Novel,Seven Up (A Stephanie Plum Novel),Hard Eight : A Stephanie Plum Novel (A Stephanie Plum Novel),The Mulberry Tree,Full House (Janet Evanovich's Full Series),"Forever... : A Novel of Good and Evil, Love and Hope"
Tom Clancy's Op-Center (Tom Clancy's Op Center (Paperback)),Exclusive,Invasion,"Truly, Madly Manhattan",Rainbow Six,Jacob Have I Loved
Touching Evil,"Forever... : A Novel of Good and Evil, Love and Hope",Killjoy,The Jester,Envy,Mercy
Toxin,Dolores Claiborne,Invasion,Watchers,Acceptable Risk,Vector
Tribulation Force: The Continuing Drama of Those Left Behind (Left Behind No. 2),Left Behind: A Novel of the Earth's Last Days (Left Behind No. 1),Nicolae: The Rise of Antichrist (Left Behind No. 3),The Next Accident,Dust to Dust,The Summerhouse
"Truly, Madly Manhattan",Macgregor Brides (Macgregors),Summer Pleasures,Engaging The Enemy,River's End,The Reef
"Tuesdays with Morrie: An Old Man, a Young Man, and Life's Greatest Lesson",The Five People You Meet in Heaven,Girl in Hyacinth Blue,Stupid White Men ...and Other Sorry Excuses for the State of the Nation!,The Girls' Guide to Hunting and Fishing,The Notebook
Turtle Moon,Blue Diary,Range of Motion,Wanderlust,Dr. Atkins' New Diet Revolution,Here on Earth
Two for the Dough,One for the Money (A Stephanie Plum Novel),Four To Score (A Stephanie Plum Novel),Seven Up (A Stephanie Plum Novel),Three To Get Deadly : A Stephanie Plum Novel (A Stephanie Plum Novel),High Five (A Stephanie Plum Novel)
Under the Tuscan Sun,C Is for Corpse (Kinsey Millhone Mysteries (Paperback)),Cold Sassy Tree,The No. 1 Ladies' Detective Agency (Today Show Book Club #8),How to Be Good,Q Is for Quarry
Unnatural Exposure,The Body Farm,Night Sins,Point of Origin,From Potter's Field,Cruel &amp; Unusual (Kay Scarpetta Mysteries (Paperback))
Unspeakable,Exclusive,Standoff,The Long Road Home,Fine Things,Let Me Call You Sweetheart
Vanished,Accident,Daddy,Heartbeat,Secrets,No Greater Love
Vector,Chromosome 6,Contagion,Harvest,Toxin,From the Corner of His Eye
Vinegar Hill (Oprah's Book Club (Paperback)),The Rapture of Canaan,Songs in Ordinary Time (Oprah's Book Club (Paperback)),Charming Billy,"River, Cross My Heart",A Lesson Before Dying (Vintage Contemporaries (Paperback))
Violets Are Blue,Four Blind Mice,Kiss the Girls,Roses Are Red (Alex Cross Novels),Fear Nothing,2nd Chance
Violin,Taltos: Lives of the Mayfair Witches,The Witching Hour (Lives of the Mayfair Witches),The Tale of the Body Thief (Vampire Chronicles (Paperback)),Interview with the Vampire,The Bad Place
Voyager,Dragonfly in Amber,Drums of Autumn,Outlander,Cold Mountain,Falling Angels
WLD ACCORDNG GARP,Degree of Guilt,Acceptable Risk,Fortune's Rocks: A Novel,The Prince of Tides,"The Vampire Lestat (Vampire Chronicles, Book II)"
Waiting to Exhale,Winter Moon,Long After Midnight,Fat Tuesday,How Stella Got Her Groove Back,Summer Pleasures
Wanderlust,Message from Nam,The Long Road Home,Heartbeat,Fine Things,Five Days in Paris
Watchers,Hideaway,Icebound,Dolores Claiborne,Lightning,Dark Rivers of the Heart
Watermelon,Mother of Pearl,Bridget Jones: The Edge of Reason,Mind Prey,The Killing Game: Only One Can Win...and the Loser Dies,A Day Late and a Dollar Short
Watership Down,Beloved (Plume Contemporary Fiction),The English Patient,The Witching Hour (Lives of the Mayfair Witches),The Girl Who Loved Tom Gordon,"The Fellowship of the Ring (The Lord of the Rings, Part 1)"
We Were the Mulvaneys,Jewel,Fall On Your Knees (Oprah #45),"River, Cross My Heart",White Oleander : A Novel,Icy Sparks
We'll Meet Again,Pretend You Don't See Her,While My Pretty One Sleeps,Daddy's Little Girl,Family Album,Mr. Murder
Weep No More My Lady,On the Street Where You Live,Let Me Call You Sweetheart,My Gal Sunday,You Belong To Me,Before I Say Good-Bye
Welcome to Temptation,Paradise,Macgregor Brides (Macgregors),The Villa,Night Whispers,Mercy
"Welcome to the World, Baby Girl!",Airframe,Sphere,Morality for Beautiful Girls (No.1 Ladies Detective Agency),Daisy Fay and the Miracle Man,The Last Precinct
What Looks Like Crazy On An Ordinary Day,Ellen Foster,Watchers,All That Remains (Kay Scarpetta Mysteries (Paperback)),The Girls' Guide to Hunting and Fishing,We Were the Mulvaneys
What to Expect When You're Expecting (Revised Edition),Sea Swept (Quinn Brothers (Paperback)),River's End,The Rainmaker,Chicken Soup for the Woman's Soul (Chicken Soup for the Soul Series (Paper)),Jewels of the Sun (Irish Trilogy)
When the Wind Blows,Still Waters,Along Came a Spider (Alex Cross Novels),Kiss the Girls,Cat &amp; Mouse (Alex Cross Novels),Roses Are Red (Alex Cross Novels)
Where the Heart Is (Oprah's Book Club (Paperback)),Blue Diary,The Lovely Bones: A Novel,I Know This Much Is True,Icy Sparks,Deck the Halls (Holiday Classics)
Where the Red Fern Grows,Misery,Slammerkin,Under the Tuscan Sun,The Hobbit : The Enchanting Prelude to The Lord of the Rings,Anne of the Island
While I Was Gone,Songs in Ordinary Time (Oprah's Book Club (Paperback)),"River, Cross My Heart",Jewel,Snow Falling on Cedars,We Were the Mulvaneys
While My Pretty One Sleeps,Lightning,Dark Rivers of the Heart,The Cradle Will Fall,Dragon Tears,Before I Say Good-Bye
"Whirlwind (Tyler, Book 1)",The Woman Next Door,Heartbreaker,Sacred Sins,The Bachelor (Warner Books Contemporary Romance),Standoff
Whispers,Winter Moon,Fear Nothing,Midnight,Phantoms,By the Light of the Moon
White Oleander : A Novel,We Were the Mulvaneys,Fine Things,Fall On Your Knees (Oprah #45),Icy Sparks,The Hours: A Novel
White Oleander : A Novel (Oprah's Book Club),Girl in Hyacinth Blue,The Giver (21st Century Reference),The Lovely Bones: A Novel,The Ugly Duckling,Snow Falling on Cedars
White Teeth: A Novel,Five Quarters of the Orange,High Fidelity,Fingersmith,Beach Music,Notes from a Small Island
Wicked: The Life and Times of the Wicked Witch of the West,Confessions of an Ugly Stepsister : A Novel,Empire Falls,"The Bad Beginning (A Series of Unfortunate Events, Book 1)",Peace Like a River,"Angus, Thongs and Full-Frontal Snogging: Confessions of Georgia Nicolson"
Wifey,Smart Women,Accident,Message from Nam,Summer Sisters,Wanderlust
Wild Animus,Pay It Forward,At Home in Mitford (The Mitford Years),The First Counsel,The Andromeda Strain,The Tao of Pooh
Winter Moon,Shadowfires,Before I Say Good-Bye,Midnight,Whispers,Lightning
Winter Solstice,Coming Home,From Potter's Field,Deja Dead,The Celestine Prophecy (Celestine Prophecy),Montana Sky
Wish You Well,Saving Faith,Jewel (Oprah's Book Club),The Celestine Prophecy (Celestine Prophecy),Unnatural Exposure,Still Waters
Without Remorse,The Cardinal of the Kremlin (Jack Ryan Novels),Debt of Honor (Jack Ryan Novels),Executive Orders (Jack Ryan Novels),Clear and Present Danger (Jack Ryan Novels),Rainbow Six
"Wizard and Glass (The Dark Tower, Book 4)","The Drawing of the Three (The Dark Tower, Book 2)",Black House,"The Gunslinger (The Dark Tower, Book 1)",The Regulators,The Tommyknockers
Wuthering Heights,The Thorn Birds,Primary Colors: A Novel of Politics,Dances With Wolves,"Like Water for Chocolate: A Novel in Monthly Installments With Recipes, Romances and Home Remedies",Pleading Guilty
Year of Wonders,The Eight,A Heartbreaking Work of Staggering Genius,Bridget Jones: The Edge of Reason,Drowning Ruth (Oprah's Book Club),Midwives: A Novel
You Belong To Me,"Loves Music, Loves to Dance",I'll Be Seeing You,Before I Say Good-Bye,Daddy's Little Girl,All Around the Town
Zen and the Art of Motorcycle Maintenance: An Inquiry into Values,Prodigal Summer,Pet Sematary,Midnight,The Hitchhiker's Guide to the Galaxy,A Prayer for Owen Meany
Zoya,Fine Things,Secrets,Kaleidoscope,Exclusive,Five Days in Paris
"\O\"" Is for Outlaw""",I Is for Innocent,C Is for Corpse (Kinsey Millhone Mysteries (Paperback)),H Is for Homicide (Kinsey Millhone Mysteries (Paperback)),Q Is for Quarry,E Is for Evidence: A Kinsey Millhone Mystery (Kinsey Millhone Mysteries (Paperback))
