,1st,2nd,3rd,4th,5th
Fahrenheit 451,1984,The Hitchhiker's Guide to the Galaxy,STONES FROM THE RIVER,The Divine Secrets of the Ya-Ya Sisterhood: A Novel,Harry Potter and the Sorcerer's Stone (Harry Potter (Paperback))
Faking It,Fast Women,The Mulberry Tree,The Woman Next Door,Midnight Bayou,The Jester
Fall On Your Knees (Oprah #45),A Lesson Before Dying (Vintage Contemporaries (Paperback)),We Were the Mulvaneys,House of Sand and Fog,Blue Diary,The Rapture of Canaan
Falling Angels,The Stone Diaries,Girl with a Pearl Earring,Echoes,The Shipping News : A Novel,Dragonfly in Amber
False Memory,Hideaway,From the Corner of His Eye,Winter Moon,The Alibi,The First Counsel
Family Album,Daddy's Little Girl,Dangerous,We'll Meet Again,Four Blind Mice,The Cradle Will Fall
Fast Food Nation: The Dark Side of the All-American Meal,"The Reptile Room (A Series of Unfortunate Events, Book 2)",Sudden Prey,Stupid White Men ...and Other Sorry Excuses for the State of the Nation!,Deja Dead,Brave New World
Fast Women,Faking It,The Bachelor (Warner Books Contemporary Romance),Touching Evil,Fat Tuesday,The Woman Next Door
Fat Tuesday,Exclusive,Nothing Lasts Forever,Homecoming,The Woman Next Door,Eyes of a Child
Fatal Cure,Contagion,Smart Women,Guilty as Sin,Family Album,Contact
Fatherhood,The Temple of My Familiar,"Loves Music, Loves to Dance",Misery,E Is for Evidence: A Kinsey Millhone Mystery (Kinsey Millhone Mysteries (Paperback)),The General's Daughter
Fear Nothing,Seize the Night,Shadowfires,Dark Rivers of the Heart,Whispers,Pet Sematary
Final Target,Envy,Body of Lies,Last Man Standing,Sick Puppy,Shadowfires
Fine Things,Kaleidoscope,Zoya,Secrets,Message from Nam,Exclusive
Fingersmith,How to Be Good,Coraline,Under the Tuscan Sun,White Teeth: A Novel,CAT'S EYE
Five Days in Paris,Message from Nam,The Long Road Home,Fine Things,No Greater Love,Zoya
Five Quarters of the Orange,White Teeth: A Novel,Chocolat,High Fidelity,How to Be Good,To Kill a Mockingbird
Flesh and Blood,The Murder Book,Choke,Easy Prey,2nd Chance,The Last Precinct
"Forever... : A Novel of Good and Evil, Love and Hope",The Mulberry Tree,Killjoy,Mercy,Touching Evil,Three Fates
Fortune's Rocks : A Novel,The Crimson Petal and the White,Absolute Power,It Was on Fire When I Lay Down on It,Black and Blue,Remember Me
Fortune's Rocks: A Novel,Cry Wolf,Cold Mountain,Outlander,Death du Jour,Tara Road
Foucault's Pendulum,Exclusive,The Diary of Ellen Rimbauer: My Life at Rose Red,Love in the Time of Cholera (Penguin Great Books of the 20th Century),Jacob Have I Loved,Pay It Forward
Four Blind Mice,Violets Are Blue,2nd Chance,The Testament,Family Album,Cradle and All
Four Past Midnight,Rose Madder,The Tommyknockers,It,The Regulators,The Dark Half
Four To Score (A Stephanie Plum Novel),High Five (A Stephanie Plum Novel),Two for the Dough,Seven Up (A Stephanie Plum Novel),Three To Get Deadly : A Stephanie Plum Novel (A Stephanie Plum Novel),Hot Six : A Stephanie Plum Novel (A Stephanie Plum Novel)
Fried Green Tomatoes at the Whistle Stop Cafe,Cold Mountain,The Red Tent (Bestselling Backlist),The Stone Diaries,Rebecca,Ellen Foster
From Potter's Field,All That Remains (Kay Scarpetta Mysteries (Paperback)),The Body Farm,Cruel &amp; Unusual (Kay Scarpetta Mysteries (Paperback)),Winter Solstice,Unnatural Exposure
From the Corner of His Eye,Dolores Claiborne,The Regulators,Mr. Murder,By the Light of the Moon,Toxin
Full House (Janet Evanovich's Full Series),Full Tilt (Janet Evanovich's Full Series),Seven Up (A Stephanie Plum Novel),To the Nines: A Stephanie Plum Novel,Beach House,Nerd in Shining Armor
Full Tilt (Janet Evanovich's Full Series),Full House (Janet Evanovich's Full Series),Beach House,The Next Accident,Nerd in Shining Armor,Faking It
G Is for Gumshoe (Kinsey Millhone Mysteries (Paperback)),F Is for Fugitive (Kinsey Millhone Mysteries (Paperback)),H Is for Homicide (Kinsey Millhone Mysteries (Paperback)),B Is for Burglar (Kinsey Millhone Mysteries (Paperback)),I Is for Innocent,D Is for Deadbeat (Kinsey Millhone Mysteries (Paperback))
GARDEN OF SHADOWS (Dollanger Saga (Paperback)),Message from Nam,Fine Things,Circle of Friends,That Camden Summer,Dark Angel
Gerald's Game,The Dark Half,The Tommyknockers,Four Past Midnight,Rose Madder,The Regulators
Girl in Hyacinth Blue,Balzac and the Little Chinese Seamstress : A Novel,Divine Secrets of the Ya-Ya Sisterhood: A Novel,Girl with a Pearl Earring,The Five People You Meet in Heaven,White Oleander : A Novel (Oprah's Book Club)
Girl with a Pearl Earring,The Red Tent (Bestselling Backlist),Falling Angels,One True Thing,Girl in Hyacinth Blue,Life of Pi
"Girl, Interrupted",Bridget Jones: The Edge of Reason,Midnight in the Garden of Good and Evil: A Savannah Story,The Girls' Guide to Hunting and Fishing,The Rapture of Canaan,Jemima J: A Novel About Ugly Ducklings and Swans
Good Omens,The Temple of My Familiar,The Hitchhiker's Guide to the Galaxy,The Fourth Hand,The Hours : A Novel,Pet Sematary
Good in Bed,In Her Shoes : A Novel,Family Album,The Girls' Guide to Hunting and Fishing,The Lovely Bones: A Novel,Daddy's Little Girl
Gorky Park,The English Patient,Tales of a Fourth Grade Nothing,What to Expect When You're Expecting (Revised Edition),Silence of the Lambs,The Bourne Ultimatum
Granny Dan,Message from Nam,A Man Named Dave: A Story of Triumph and Forgiveness,The Reef,GARDEN OF SHADOWS (Dollanger Saga (Paperback)),The Killing Game: Only One Can Win...and the Loser Dies
Guardian Angel,Temptation,Killjoy,Night Whispers,Heartbreaker,Dangerous
Guilty Pleasures (Anita Blake Vampire Hunter (Paperback)),A Civil Action,Welcome to Temptation,Night Whispers,Fatal Cure,Nothing Lasts Forever
Guilty as Sin,The Search,Night Sins,The Face of Deception,Unnatural Exposure,Nothing Lasts Forever
H Is for Homicide (Kinsey Millhone Mysteries (Paperback)),I Is for Innocent,E Is for Evidence: A Kinsey Millhone Mystery (Kinsey Millhone Mysteries (Paperback)),G Is for Gumshoe (Kinsey Millhone Mysteries (Paperback)),D Is for Deadbeat (Kinsey Millhone Mysteries (Paperback)),F Is for Fugitive (Kinsey Millhone Mysteries (Paperback))
Hannibal,Red Dragon,Rose Madder,"The Drawing of the Three (The Dark Tower, Book 2)",Red Storm Rising,Interview with the Vampire
Hard Eight : A Stephanie Plum Novel (A Stephanie Plum Novel),Seven Up (A Stephanie Plum Novel),High Five (A Stephanie Plum Novel),Hot Six : A Stephanie Plum Novel (A Stephanie Plum Novel),To the Nines: A Stephanie Plum Novel,Three To Get Deadly : A Stephanie Plum Novel (A Stephanie Plum Novel)
Harry Potter and the Chamber of Secrets (Book 2),Harry Potter and the Prisoner of Azkaban (Book 3),Harry Potter and the Goblet of Fire (Book 4),Harry Potter and the Sorcerer's Stone (Harry Potter (Paperback)),Harry Potter and the Sorcerer's Stone (Book 1),Harry Potter and the Order of the Phoenix (Book 5)
Harry Potter and the Goblet of Fire (Book 4),Harry Potter and the Prisoner of Azkaban (Book 3),Harry Potter and the Chamber of Secrets (Book 2),Harry Potter and the Order of the Phoenix (Book 5),Harry Potter and the Sorcerer's Stone (Book 1),Harry Potter and the Sorcerer's Stone (Harry Potter (Paperback))
Harry Potter and the Order of the Phoenix (Book 5),Harry Potter and the Goblet of Fire (Book 4),Harry Potter and the Prisoner of Azkaban (Book 3),Harry Potter and the Chamber of Secrets (Book 2),Harry Potter and the Sorcerer's Stone (Book 1),Harry Potter and the Sorcerer's Stone (Harry Potter (Paperback))
Harry Potter and the Prisoner of Azkaban (Book 3),Harry Potter and the Goblet of Fire (Book 4),Harry Potter and the Chamber of Secrets (Book 2),Harry Potter and the Order of the Phoenix (Book 5),Harry Potter and the Sorcerer's Stone (Book 1),Harry Potter and the Sorcerer's Stone (Harry Potter (Paperback))
Harry Potter and the Sorcerer's Stone (Book 1),Harry Potter and the Chamber of Secrets (Book 2),Harry Potter and the Prisoner of Azkaban (Book 3),Harry Potter and the Goblet of Fire (Book 4),Harry Potter and the Order of the Phoenix (Book 5),The Mists of Avalon
Harry Potter and the Sorcerer's Stone (Harry Potter (Paperback)),Harry Potter and the Chamber of Secrets (Book 2),Harry Potter and the Prisoner of Azkaban (Book 3),Harry Potter and the Goblet of Fire (Book 4),Harry Potter and the Order of the Phoenix (Book 5),A Time to Kill
Harvest,Colony,Envy,Exclusive,Vector,Chromosome 6
Heart of the Sea (Irish Trilogy),Jewels of the Sun (Irish Trilogy),Tears of the Moon (Irish Trilogy),Macgregor Brides (Macgregors),River's End,Portrait in Death
Heartbeat,The Long Road Home,Message from Nam,No Greater Love,Secrets,Five Days in Paris
Heartbreaker,Mercy,Sacred Sins,Killjoy,"Forever... : A Novel of Good and Evil, Love and Hope",Temptation
Hearts In Atlantis,Desperation,Lightning,Dark Rivers of the Heart,Carrie,Bag of Bones
Hearts in Atlantis,I Know This Much Is True (Oprah's Book Club),The Celestine Prophecy (Celestine Prophecy),Exclusive,Second Nature,The Tao of Pooh
Heaven and Earth (Three Sisters Island Trilogy),The Reef,Dance upon the Air (Three Sisters Island Trilogy),Face the Fire (Three Sisters Island Trilogy),Three Fates,Macgregor Brides (Macgregors)
Hemlock Bay,Purity in Death,Chosen Prey,Body of Lies,Last Man Standing,The Edge
Here on Earth,The Rapture of Canaan,Saint Maybe,Ladder of Years,The Book of Ruth (Oprah's Book Club (Paperback)),I Know This Much Is True (Oprah's Book Club)
Hide &amp; Seek,Exclusive,Cat &amp; Mouse (Alex Cross Novels),The Clinic (Alex Delaware Novels (Paperback)),Along Came a Spider (Alex Cross Novels),Unspeakable
Hideaway,Watchers,Dragon Tears,Sole Survivor,The Bad Place,Dark Rivers of the Heart
High Fidelity,About a Boy,How to Be Good,Notes from a Small Island,Five Quarters of the Orange,White Teeth: A Novel
High Five (A Stephanie Plum Novel),Four To Score (A Stephanie Plum Novel),Three To Get Deadly : A Stephanie Plum Novel (A Stephanie Plum Novel),Hot Six : A Stephanie Plum Novel (A Stephanie Plum Novel),Seven Up (A Stephanie Plum Novel),Hard Eight : A Stephanie Plum Novel (A Stephanie Plum Novel)
Holes (Yearling Newbery),Seabiscuit: An American Legend,One for the Money (Stephanie Plum Novels (Paperback)),A Patchwork Planet,No Greater Love,Night
Homecoming,Exclusive,Eyes of a Child,Fat Tuesday,Cat &amp; Mouse (Alex Cross Novels),On the Street Where You Live
Homeport,Carnal Innocence,Sanctuary,The Reef,River's End,Montana Sky
Hornet's Nest,Sudden Prey,Silent Witness,Mortal Prey,Cause of Death,Exclusive
Hot Six : A Stephanie Plum Novel (A Stephanie Plum Novel),High Five (A Stephanie Plum Novel),Hard Eight : A Stephanie Plum Novel (A Stephanie Plum Novel),Three To Get Deadly : A Stephanie Plum Novel (A Stephanie Plum Novel),Four To Score (A Stephanie Plum Novel),Seven Up (A Stephanie Plum Novel)
House of Sand and Fog,Midwives: A Novel,"River, Cross My Heart",Fall On Your Knees (Oprah #45),Icy Sparks,We Were the Mulvaneys
How Stella Got Her Groove Back,Waiting to Exhale,"Breath, Eyes, Memory",Wicked: The Life and Times of the Wicked Witch of the West,Snow Falling on Cedars,Slammerkin
How to Be Good,High Fidelity,Saint Maybe,A Prayer for Owen Meany,Under the Tuscan Sun,The Hours: A Novel
How to Make an American Quilt,A Map of the World,The Phantom Tollbooth,The Witness,Daisy Fay and the Miracle Man,A Year in Provence
I Capture the Castle,Seabiscuit,The Hitchhiker's Guide to the Galaxy,Midnight in the Garden of Good and Evil,"Like Water for Chocolate : A Novel in Monthly Installments with Recipes, Romances, and Home Remedies",Slammerkin
I Is for Innocent,E Is for Evidence: A Kinsey Millhone Mystery (Kinsey Millhone Mysteries (Paperback)),J Is for Judgment,H Is for Homicide (Kinsey Millhone Mysteries (Paperback)),F Is for Fugitive (Kinsey Millhone Mysteries (Paperback)),C Is for Corpse (Kinsey Millhone Mysteries (Paperback))
I Know This Much Is True,Sea Glass: A Novel,Blue Diary,Where the Heart Is (Oprah's Book Club (Paperback)),Saint Maybe,Here on Earth
I Know This Much Is True (Oprah's Book Club),The Angel of Darkness,Hearts in Atlantis,Here on Earth,The Shipping News : A Novel,Second Nature
I Know Why the Caged Bird Sings,The Long Road Home,Exclusive,A Prayer for Owen Meany,Jacob Have I Loved,The Giver (21st Century Reference)
I'll Be Seeing You,You Belong To Me,Let Me Call You Sweetheart,Daddy's Little Girl,Before I Say Good-Bye,On the Street Where You Live
Icebound,Watchers,Dark Rivers of the Heart,Skeleton Crew,Hideaway,Lightning
Icy Sparks,House of Sand and Fog,We Were the Mulvaneys,The Dogs of Babel (Today Show Book Club #12),Homecoming,A Day Late and a Dollar Short
If Only It Were True,Remember Me,The Cradle Will Fall,The Most Wanted,The Witness,Daddy
If Tomorrow Comes,Master of the Game,The Talisman,The Guardian,Timeline,Needful Things
In Her Shoes : A Novel,Good in Bed,The Boy Next Door,The Five People You Meet in Heaven,Confessions of a Shopaholic (Summer Display Opportunity),Flesh and Blood
Inner Harbor (Quinn Brothers (Paperback)),Rising Tides,Sea Swept (Quinn Brothers (Paperback)),Heart of the Sea (Irish Trilogy),Tears of the Moon (Irish Trilogy),Portrait in Death
Insomnia,Rose Madder,Desperation,The Dark Half,Pet Sematary,Nightmares &amp; Dreamscapes
Intensity,Dolores Claiborne,Toxin,Misery,From the Corner of His Eye,Bag of Bones
Interview with the Vampire,"The Vampire Lestat (Vampire Chronicles, Book II)",The Tale of the Body Thief (Vampire Chronicles (Paperback)),The Witching Hour (Lives of the Mayfair Witches),The Queen of the Damned (Vampire Chronicles (Paperback)),Skeleton Crew
Into Thin Air : A Personal Account of the Mt. Everest Disaster,Tis : A Memoir,The Shipping News : A Novel,A Civil Action,Saint Maybe,Mystic River
Into the Wild,A Widow for One Year,A Man in Full,A Year in Provence,Moo,Good Omens
Invasion,Acceptable Risk,Chromosome 6,Tom Clancy's Op-Center (Tom Clancy's Op Center (Paperback)),The Cradle Will Fall,Toxin
Irish Hearts,Macgregor Brides (Macgregors),Heart of the Sea (Irish Trilogy),Stanislaski Brothers (Silhouette Promo),Macgregor Grooms (Macgregors),Tears of the Moon (Irish Trilogy)
Isle of Dogs,Southern Cross,Shadow Prey,Chosen Prey,The Clinic (Alex Delaware Novels (Paperback)),Easy Prey
It,The Regulators,Four Past Midnight,The Tommyknockers,Rose Madder,Cujo
It Was on Fire When I Lay Down on It,Hearts in Atlantis,Fortune's Rocks : A Novel,All I Really Need to Know,The Bonesetter's Daughter,Neverwhere
It's Always Something,The Sands of Time,The Bourne Identity,Slow Waltz in Cedar Bend,From Potter's Field,Point of Origin
J Is for Judgment,I Is for Innocent,E Is for Evidence: A Kinsey Millhone Mystery (Kinsey Millhone Mysteries (Paperback)),H Is for Homicide (Kinsey Millhone Mysteries (Paperback)),M Is for Malice,K Is for Killer (Kinsey Millhone Mysteries (Paperback))
Jack &amp; Jill (Alex Cross Novels),The Long Road Home,Heartbeat,While My Pretty One Sleeps,Before I Say Good-Bye,Five Days in Paris
Jacob Have I Loved,Exclusive,The Burden of Proof,Tom Clancy's Op-Center (Tom Clancy's Op Center (Paperback)),L Is for Lawless,Colony
Jemima J: A Novel About Ugly Ducklings and Swans,The Virgin Suicides,Shopaholic Takes Manhattan (Summer Display Opportunity),"Girl, Interrupted",The Honk and Holler Opening Soon,Under the Tuscan Sun
Jewel,We Were the Mulvaneys,"River, Cross My Heart",The Reader,Songs in Ordinary Time (Oprah's Book Club (Paperback)),While I Was Gone
Jewel (Oprah's Book Club),Chicken Soup for the Soul (Chicken Soup for the Soul),Exclusive,The Secret Garden,Wish You Well,Angela's Ashes (MMP) : A Memoir
Jewels of the Sun (Irish Trilogy),Heart of the Sea (Irish Trilogy),Tears of the Moon (Irish Trilogy),Macgregor Brides (Macgregors),River's End,Purity in Death
Journey,Secrets,Kaleidoscope,Five Days in Paris,The Reef,Fine Things
Jurassic Park,The Lost World,Rising Sun,Sphere,Airframe,The Body Farm
K Is for Killer (Kinsey Millhone Mysteries (Paperback)),D Is for Deadbeat (Kinsey Millhone Mysteries (Paperback)),C Is for Corpse (Kinsey Millhone Mysteries (Paperback)),E Is for Evidence: A Kinsey Millhone Mystery (Kinsey Millhone Mysteries (Paperback)),B Is for Burglar (Kinsey Millhone Mysteries (Paperback)),I Is for Innocent
Kaleidoscope,Fine Things,Message from Nam,Secrets,Zoya,Exclusive
Key of Knowledge (Key Trilogy (Paperback)),Key of Light (Key Trilogy (Paperback)),"Key of Valor (Roberts, Nora. Key Trilogy, 3.)",Birthright,Sacred Sins,Purity in Death
Key of Light (Key Trilogy (Paperback)),Key of Knowledge (Key Trilogy (Paperback)),"Key of Valor (Roberts, Nora. Key Trilogy, 3.)",Birthright,Purity in Death,Midnight Bayou
"Key of Valor (Roberts, Nora. Key Trilogy, 3.)",Key of Knowledge (Key Trilogy (Paperback)),Purity in Death,Key of Light (Key Trilogy (Paperback)),Night Whispers,Face the Fire (Three Sisters Island Trilogy)
Killjoy,Mercy,"Forever... : A Novel of Good and Evil, Love and Hope",Paradise,Temptation,Night Whispers
Kiss the Girls,The Killing Game: Only One Can Win...and the Loser Dies,Violets Are Blue,Roses Are Red (Alex Cross Novels),Along Came a Spider (Alex Cross Novels),The Poisonwood Bible
L Is for Lawless,M Is for Malice,E Is for Evidence: A Kinsey Millhone Mystery (Kinsey Millhone Mysteries (Paperback)),K Is for Killer (Kinsey Millhone Mysteries (Paperback)),J Is for Judgment,F Is for Fugitive (Kinsey Millhone Mysteries (Paperback))
Ladder of Years,The Accidental Tourist,Here on Earth,Saint Maybe,Animal Dreams,Secret History
Lake Wobegon Days,Remember Me,Stillwatch,The Giver (21st Century Reference),Sea Glass: A Novel,Exclusive
"Lamb : The Gospel According to Biff, Christ's Childhood Pal",Bleachers,Love in the Time of Cholera (Penguin Great Books of the 20th Century),A Wrinkle In Time,Tears of the Giraffe (No.1 Ladies Detective Agency),Morality for Beautiful Girls (No.1 Ladies Detective Agency)
Last Chance Saloon,The Long Road Home,The Idiot Girls' Action Adventure Club,Exclusive,Paradise,The House of the Spirits
Last Man Standing,Mortal Prey,Over the Edge,Q Is for Quarry,Final Target,Chosen Prey
Left Behind: A Novel of the Earth's Last Days (Left Behind No. 1),Tribulation Force: The Continuing Drama of Those Left Behind (Left Behind No. 2),Nicolae: The Rise of Antichrist (Left Behind No. 3),The Mulberry Tree,The Client,Night Whispers
Let Me Call You Sweetheart,Before I Say Good-Bye,Weep No More My Lady,I'll Be Seeing You,Exclusive,You Belong To Me
Life of Pi,Tell No One,The Lovely Bones: A Novel,Fried Green Tomatoes at the Whistle Stop Cafe,Fall On Your Knees (Oprah #45),Balzac and the Little Chinese Seamstress : A Novel
Lightning,Fine Things,While My Pretty One Sleeps,Dark Rivers of the Heart,Shadowfires,Before I Say Good-Bye
"Like Water for Chocolate : A Novel in Monthly Installments with Recipes, Romances, and Home Remedies",I Capture the Castle,The Celestine Prophecy (Celestine Prophecy),The Catcher in the Rye,The Kitchen God's Wife,Black and Blue
"Like Water for Chocolate: A Novel in Monthly Installments With Recipes, Romances and Home Remedies",The Giver (21st Century Reference),The Dogs of Babel (Today Show Book Club #12),The Temple of My Familiar,"All the Pretty Horses (The Border Trilogy, Vol 1)",The Shipping News : A Novel
"Like Water for Chocolate: A Novel in Monthly Installments, With Recipes, Romances, and Home Remedies",The Phantom Tollbooth,Range of Motion,Atonement : A Novel,Anne Frank: The Diary of a Young Girl,"Like Water for Chocolate : A Novel in Monthly Installments with Recipes, Romances, and Home Remedies"
Little Altars Everywhere: A Novel,The Shipping News : A Novel,STONES FROM THE RIVER,The Pull of the Moon,Seven Habits Of Highly Effective People,The Pilot's Wife : A Novel
Long After Midnight,Final Target,Waiting to Exhale,River's End,Last Man Standing,Presumed Innocent
Lord of the Flies,Midnight in the Garden of Good and Evil,Animal Farm,Into Thin Air : A Personal Account of the Mt. Everest Disaster,To Kill a Mockingbird,The Rainmaker
Love in the Time of Cholera (Penguin Great Books of the 20th Century),Pigs in Heaven,Ender's Game (Ender Wiggins Saga (Paperback)),Matilda,Empire Falls,Prodigal Summer
"Loves Music, Loves to Dance",You Belong To Me,Moonlight Becomes You,My Gal Sunday,The Face of Deception,While My Pretty One Sleeps
Lucky : A Memoir,The Lovely Bones: A Novel,The Sweet Potato Queens' Book of Love,A Civil Action,One True Thing,Bridget Jones's Diary
M Is for Malice,L Is for Lawless,J Is for Judgment,G Is for Gumshoe (Kinsey Millhone Mysteries (Paperback)),F Is for Fugitive (Kinsey Millhone Mysteries (Paperback)),I Is for Innocent
Macgregor Brides (Macgregors),Portrait in Death,Stanislaski Brothers (Silhouette Promo),The Reef,Jewels of the Sun (Irish Trilogy),Heart of the Sea (Irish Trilogy)
Macgregor Grooms (Macgregors),Stanislaski Brothers (Silhouette Promo),Face the Fire (Three Sisters Island Trilogy),The Reef,Irish Hearts,Birthright
Master of the Game,If Tomorrow Comes,The Long Road Home,The Bad Place,The Tommyknockers,"The Drawing of the Three (The Dark Tower, Book 2)"
Matilda,Love in the Time of Cholera (Penguin Great Books of the 20th Century),Holes (Yearling Newbery),Bastard Out of Carolina,The Angel of Darkness,Seabiscuit: An American Legend
Me Talk Pretty One Day,Naked,The Idiot Girls' Action Adventure Club,Beloved (Plume Contemporary Fiction),SHIPPING NEWS,Coraline
"Men Are from Mars, Women Are from Venus: A Practical Guide for Improving Communication and Getting What You Want in Your Relationships",Jack &amp; Jill (Alex Cross Novels),Exclusive,The Clinic (Alex Delaware Novels (Paperback)),Smilla's Sense of Snow,The Edge
Mercy,Killjoy,"Forever... : A Novel of Good and Evil, Love and Hope",Heartbreaker,Purity in Death,Night Whispers
Message from Nam,The Long Road Home,Dawn (Cutler),Kaleidoscope,Fine Things,Five Days in Paris
Message in a Bottle,Nights in Rodanthe,The Mulberry Tree,A Walk to Remember,River's End,Nightmares &amp; Dreamscapes
Middlesex: A Novel,She's Come Undone (Oprah's Book Club (Paperback)),The Secret Life of Bees,The Da Vinci Code,I Know This Much Is True (Oprah's Book Club),Prodigal Summer
Midnight,Winter Moon,Dark Rivers of the Heart,Shadowfires,While My Pretty One Sleeps,Before I Say Good-Bye
Midnight Bayou,River's End,The Mulberry Tree,Three Fates,Birthright,Sanctuary
Midnight in the Garden of Good and Evil,A Wrinkle in Time,The Temple of My Familiar,Seabiscuit,Pigs in Heaven,The Sweet Potato Queens' Book of Love
Midnight in the Garden of Good and Evil: A Savannah Story,The Blind Assassin,Three Junes,The Poisonwood Bible: A Novel,"Girl, Interrupted",Bastard Out of Carolina
Midwives: A Novel,House of Sand and Fog,The Girls' Guide to Hunting and Fishing,A Map of the World,Peace Like a River,One for the Money (Stephanie Plum Novels (Paperback))
Mind Prey,Sudden Prey,Mortal Prey,Rules of Prey,Chosen Prey,Night Prey
Mirror Image,Five Days in Paris,Message from Nam,The Long Road Home,Purity in Death,Wanderlust
Misery,The Tommyknockers,It,Bag of Bones,Thinner,Insomnia
Miss Julia Speaks Her Mind : A Novel,The Summerhouse,At Home in Mitford (The Mitford Years),Hard Eight : A Stephanie Plum Novel (A Stephanie Plum Novel),The Devil Wears Prada : A Novel,Pop Goes the Weasel
Montana Sky,Carnal Innocence,The Reef,Homeport,Macgregor Brides (Macgregors),Heaven and Earth (Three Sisters Island Trilogy)
Moo,The Hours : A Novel,Plainsong (Vintage Contemporaries),A Thousand Acres (Ballantine Reader's Circle),Into the Wild,A Virtuous Woman (Oprah's Book Club (Paperback))
Moonlight Becomes You,"Loves Music, Loves to Dance",The Face of Deception,You Belong To Me,Daddy's Little Girl,My Gal Sunday
Morality for Beautiful Girls (No.1 Ladies Detective Agency),Tears of the Giraffe (No.1 Ladies Detective Agency),The No. 1 Ladies' Detective Agency (Today Show Book Club #8),Digital Fortress : A Thriller,"Welcome to the World, Baby Girl!",Pigs in Heaven
Mortal Fear,Mind Prey,Mortal Prey,Rules of Prey,Final Target,By the Light of the Moon
Mortal Prey,Chosen Prey,Last Man Standing,Mind Prey,Easy Prey,Sudden Prey
Mother of Pearl,A Patchwork Planet,We Were the Mulvaneys,Exclusive,"River, Cross My Heart",The Honk and Holler Opening Soon
Mr. Murder,Dark Rivers of the Heart,We'll Meet Again,No Greater Love,Icebound,From the Corner of His Eye
My Gal Sunday,Before I Say Good-Bye,"Loves Music, Loves to Dance",You Belong To Me,Weep No More My Lady,While My Pretty One Sleeps
Mystic River,Cold Mountain,The Switch,Cry Wolf,Saving Faith,Into Thin Air : A Personal Account of the Mt. Everest Disaster
N Is for Noose,B Is for Burglar (Kinsey Millhone Mysteries (Paperback)),E Is for Evidence: A Kinsey Millhone Mystery (Kinsey Millhone Mysteries (Paperback)),C Is for Corpse (Kinsey Millhone Mysteries (Paperback)),Southern Cross,I Is for Innocent
Naked,Me Talk Pretty One Day,Bastard Out of Carolina,Brave New World,Bridget Jones : The Edge of Reason,1984
Needful Things,Pet Sematary,Insomnia,Christine,The Tommyknockers,Bag of Bones
Nerd in Shining Armor,"Key of Valor (Roberts, Nora. Key Trilogy, 3.)",Purity in Death,Full Tilt (Janet Evanovich's Full Series),"Forever... : A Novel of Good and Evil, Love and Hope",The Bachelor (Warner Books Contemporary Romance)
Neverwhere,It Was on Fire When I Lay Down on It,"Wizard and Glass (The Dark Tower, Book 4)",Fortune's Rocks : A Novel,Foucault's Pendulum,False Memory
Nickel and Dimed: On (Not) Getting By in America,The Glass Lake,The Lovely Bones: A Novel,White Oleander : A Novel (Oprah's Book Club),Cry Wolf,Flesh and Blood
Nicolae: The Rise of Antichrist (Left Behind No. 3),Left Behind: A Novel of the Earth's Last Days (Left Behind No. 1),Tribulation Force: The Continuing Drama of Those Left Behind (Left Behind No. 2),The Burden of Proof,Violets Are Blue,Night Whispers
Night,Exclusive,Before I Say Good-Bye,Degree of Guilt,Let Me Call You Sweetheart,The Long Road Home
Night Prey,Rules of Prey,Shadow Prey,Mind Prey,Easy Prey,Body of Evidence (Kay Scarpetta Mysteries (Paperback))
Night Sins,Body of Lies,Unnatural Exposure,Cry Wolf,The Switch,Guilty as Sin
Night Whispers,Portrait in Death,Macgregor Brides (Macgregors),Small Town Girl,Purity in Death,Killjoy
