,1st,2nd,3rd,4th,5th
1984,Animal Farm,The Handmaid's Tale,Brave New World,"The Vampire Lestat (Vampire Chronicles, Book II)",The Hours : A Novel
1st to Die: A Novel,Along Came a Spider (Alex Cross Novels),Roses Are Red (Alex Cross Novels),Pop Goes the Weasel,Violets Are Blue,Lightning
2nd Chance,Four Blind Mice,The Next Accident,Violets Are Blue,The Murder Book,Flesh and Blood
4 Blondes,The House of the Spirits,Pride and Prejudice,Pleading Guilty,Seabiscuit,Notes from a Small Island
A Bend in the Road,A Walk to Remember,The Last Time They Met : A Novel,Sea Glass: A Novel,Angels,Family Album
A Case of Need,Clear and Present Danger (Jack Ryan Novels),Exclusive,Harvest,Mind Prey,The Hundred Secret Senses
"A Child Called \It\"": One Child's Courage to Survive""",A Man Named Dave: A Story of Triumph and Forgiveness,Range of Motion,On the Street Where You Live,Lightning,The Giver (21st Century Reference)
A Civil Action,No Safe Place,The Genesis Code,The Temple of My Familiar,The Handmaid's Tale,The Shipping News : A Novel
A Day Late and a Dollar Short,Exclusive,The Simple Truth,We Were the Mulvaneys,Icy Sparks,Disclosure
A Fine Balance,The Hours : A Novel,"The Amber Spyglass (His Dark Materials, Book 3)",The Blind Assassin,Falling Angels,Three Junes
A Great Deliverance,Death du Jour,Cry Wolf,C Is for Corpse (Kinsey Millhone Mysteries (Paperback)),Winter Solstice,Cold Mountain
A Heartbreaking Work of Staggering Genius,Year of Wonders,The Giver (21st Century Reference),Blessings,The Girls' Guide to Hunting and Fishing,Plainsong (Vintage Contemporaries)
A Is for Alibi (Kinsey Millhone Mysteries (Paperback)),E Is for Evidence: A Kinsey Millhone Mystery (Kinsey Millhone Mysteries (Paperback)),K Is for Killer (Kinsey Millhone Mysteries (Paperback)),I Is for Innocent,C Is for Corpse (Kinsey Millhone Mysteries (Paperback)),B Is for Burglar (Kinsey Millhone Mysteries (Paperback))
A Lesson Before Dying (Vintage Contemporaries (Paperback)),Fall On Your Knees (Oprah #45),The Virgin Suicides,"River, Cross My Heart",The Reader,Chicken Soup for the Woman's Soul (Chicken Soup for the Soul Series (Paper))
A Man Named Dave: A Story of Triumph and Forgiveness,Granny Dan,Blue Diary,"A Child Called \It\"": One Child's Courage to Survive""",The Rescue,The Kiss
A Man in Full,Absolute Power,The Angel of Darkness,Plum Island,Jacob Have I Loved,Easy Prey
A Map of the World,House of Sand and Fog,How to Make an American Quilt,Midwives: A Novel,The Rapture of Canaan,Cold Sassy Tree
A Painted House,The Brethren,We Were the Mulvaneys,Touching Evil,Fall On Your Knees (Oprah #45),The Firm
A Patchwork Planet,Mother of Pearl,Exclusive,Don't Stand Too Close to a Naked Man,Holes (Yearling Newbery),Disclosure
A Prayer for Owen Meany,The Fourth Hand,Empire Falls,I Know Why the Caged Bird Sings,How to Be Good,Zen and the Art of Motorcycle Maintenance: An Inquiry into Values
A Thin Dark Line (Mysteries &amp; Horror),Ashes to Ashes,The Ugly Duckling,Cry Wolf,The Face of Deception,Key of Light (Key Trilogy (Paperback))
A Thousand Acres (Ballantine Reader's Circle),Charming Billy,The Hours : A Novel,The Bonfire of the Vanities,The Robber Bride,Pigs in Heaven
A Time to Kill,The Pelican Brief,The Client,The Firm,The Chamber,The Rainmaker
A Virtuous Woman (Oprah's Book Club (Paperback)),Blue Diary,Moo,The Reader,Back Roads,Slammerkin
A Walk to Remember,The Rescue,Nights in Rodanthe,The Notebook,Granny Dan,A Bend in the Road
A Widow for One Year,The God of Small Things,Into the Wild,Big Trouble,A Prayer for Owen Meany,The English Patient
A Wrinkle In Time,A Wrinkle in Time,The Phantom Tollbooth,Jacob Have I Loved,Harry Potter and the Order of the Phoenix (Book 5),Mind Prey
A Wrinkle in Time,A Wrinkle In Time,Midnight in the Garden of Good and Evil,The Phantom Tollbooth,Mind Prey,The Catcher in the Rye
A Year in Provence,The Phantom Tollbooth,Coraline,A Wrinkle in Time,How to Make an American Quilt,Into the Wild
ANGELA'S ASHES,Love in the Time of Cholera (Penguin Great Books of the 20th Century),The Red Tent (Bestselling Backlist),The Catcher in the Rye,Schindler's List,Life of Pi
About a Boy,High Fidelity,How to Be Good,Notes from a Small Island,A Prayer for Owen Meany,Zen and the Art of Motorcycle Maintenance: An Inquiry into Values
Absolute Power,A Man in Full,Pleading Guilty,Airframe,Sphere,Fortune's Rocks : A Novel
Acceptable Risk,Chromosome 6,Invasion,Toxin,Watchers,Dolores Claiborne
Accident,Daddy,Vanished,Fine Things,Wifey,Wanderlust
Airframe,Sphere,Absolute Power,"Welcome to the World, Baby Girl!",Jurassic Park,Fatal Cure
All Around the Town,You Belong To Me,Before I Say Good-Bye,"Loves Music, Loves to Dance",Daddy's Little Girl,My Gal Sunday
All I Really Need to Know,It Was on Fire When I Lay Down on It,Message in a Bottle,"Wizard and Glass (The Dark Tower, Book 4)",A Civil Action,Chocolat
All That Remains (Kay Scarpetta Mysteries (Paperback)),From Potter's Field,Cruel &amp; Unusual (Kay Scarpetta Mysteries (Paperback)),Body of Evidence (Kay Scarpetta Mysteries (Paperback)),The Body Farm,The Clinic (Alex Delaware Novels (Paperback))
"All the Pretty Horses (The Border Trilogy, Vol 1)",Second Nature,Smilla's Sense of Snow,"Like Water for Chocolate: A Novel in Monthly Installments With Recipes, Romances and Home Remedies",The Shipping News : A Novel,The Stone Diaries
Along Came a Spider (Alex Cross Novels),Kiss the Girls,Hide &amp; Seek,The Clinic (Alex Delaware Novels (Paperback)),The Client,1st to Die: A Novel
American Gods,"The Golden Compass (His Dark Materials, Book 1)",The Eyre Affair: A Novel,Seabiscuit: An American Legend,"The Amber Spyglass (His Dark Materials, Book 3)",Coraline
Angela's Ashes (MMP) : A Memoir,Echoes,Harvest,Colony,I Know Why the Caged Bird Sings,Jewel (Oprah's Book Club)
Angela's Ashes: A Memoir,The Hours : A Novel,A Widow for One Year,Drowning Ruth,Plainsong (Vintage Contemporaries),The Great Gatsby
Angels,A Bend in the Road,Exclusive,Girl in Hyacinth Blue,Under the Tuscan Sun,One for the Money (Stephanie Plum Novels (Paperback))
Angels &amp; Demons,The Da Vinci Code,The Sweet Potato Queens' Book of Love,Bel Canto: A Novel,A Wrinkle in Time,Tears of the Giraffe (No.1 Ladies Detective Agency)
"Angus, Thongs and Full-Frontal Snogging: Confessions of Georgia Nicolson","The Bad Beginning (A Series of Unfortunate Events, Book 1)",Wicked: The Life and Times of the Wicked Witch of the West,Animal Farm,Confessions of an Ugly Stepsister : A Novel,Exclusive
Animal Dreams,The Bean Trees,Ladder of Years,Cold Mountain : A Novel,Winter Solstice,She's Come Undone (Oprah's Book Club (Paperback))
Animal Farm,1984,"Angus, Thongs and Full-Frontal Snogging: Confessions of Georgia Nicolson",Midnight,Second Nature,Call of the Wild
Anne Frank: The Diary of a Young Girl,"Scarlett : The Sequel to Margaret Mitchell's \Gone With the Wind\""""",How Stella Got Her Groove Back,"Like Water for Chocolate: A Novel in Monthly Installments, With Recipes, Romances, and Home Remedies",The Secret Garden,The Hours: A Novel
Anne of Avonlea (Anne of Green Gables Novels (Paperback)),Anne of the Island,The Witness,Anne of Green Gables (Anne of Green Gables Novels (Paperback)),Beloved,Harry Potter and the Prisoner of Azkaban (Book 3)
Anne of Green Gables (Anne of Green Gables Novels (Paperback)),Anne of the Island,Anne of Avonlea (Anne of Green Gables Novels (Paperback)),Secrets,Midnight in the Garden of Good and Evil,The Alienist
Anne of the Island,Anne of Avonlea (Anne of Green Gables Novels (Paperback)),Anne of Green Gables (Anne of Green Gables Novels (Paperback)),Bridge to Terabithia,Secrets,A Thin Dark Line (Mysteries &amp; Horror)
"Artemis Fowl (Artemis Fowl, Book 1)",A Wrinkle in Time,Rising Tides,The Fourth Hand,Accident,Moo
Ashes to Ashes,A Thin Dark Line (Mysteries &amp; Horror),Eyes of a Child,Standoff,The Plains of Passage (Earth's Children (Paperback)),The Search
At Home in Mitford (The Mitford Years),Miss Julia Speaks Her Mind : A Novel,Cold Sassy Tree,Chicken Soup for the Soul (Chicken Soup for the Soul),Wild Animus,Don't Stand Too Close to a Naked Man
Atonement : A Novel,Girl in Hyacinth Blue,"Like Water for Chocolate: A Novel in Monthly Installments, With Recipes, Romances, and Home Remedies",Balzac and the Little Chinese Seamstress : A Novel,I Know This Much Is True,A Man Named Dave: A Story of Triumph and Forgiveness
B Is for Burglar (Kinsey Millhone Mysteries (Paperback)),F Is for Fugitive (Kinsey Millhone Mysteries (Paperback)),D Is for Deadbeat (Kinsey Millhone Mysteries (Paperback)),I Is for Innocent,G Is for Gumshoe (Kinsey Millhone Mysteries (Paperback)),E Is for Evidence: A Kinsey Millhone Mystery (Kinsey Millhone Mysteries (Paperback))
Back Roads,"River, Cross My Heart",A Lesson Before Dying (Vintage Contemporaries (Paperback)),Midwives: A Novel,What Looks Like Crazy On An Ordinary Day,A Bend in the Road
Bag of Bones,The Tommyknockers,Desperation,Carrie,It,Skeleton Crew
Balzac and the Little Chinese Seamstress : A Novel,Girl in Hyacinth Blue,Tears of the Giraffe (No.1 Ladies Detective Agency),Secret History,Bastard Out of Carolina,The Poisonwood Bible
Bastard Out of Carolina,The Handmaid's Tale,The Blind Assassin,The Poisonwood Bible,The Virgin Suicides,A Thousand Acres (Ballantine Reader's Circle)
Beach House,"Forever... : A Novel of Good and Evil, Love and Hope",Mercy,Full Tilt (Janet Evanovich's Full Series),Touching Evil,Full House (Janet Evanovich's Full Series)
Beach Music,Hot Six : A Stephanie Plum Novel (A Stephanie Plum Novel),White Teeth: A Novel,"Scarlett : The Sequel to Margaret Mitchell's \Gone With the Wind\""""",Fat Tuesday,Songs in Ordinary Time (Oprah's Book Club (Paperback))
Before I Say Good-Bye,My Gal Sunday,Pretend You Don't See Her,Exclusive,Let Me Call You Sweetheart,Winter Moon
Bel Canto: A Novel,Tears of the Giraffe (No.1 Ladies Detective Agency),The Bean Trees,A Prayer for Owen Meany,Wicked: The Life and Times of the Wicked Witch of the West,Angels &amp; Demons
Beloved,Zen and the Art of Motorcycle Maintenance: An Inquiry into Values,The Temple of My Familiar,Anne of Avonlea (Anne of Green Gables Novels (Paperback)),Riptide,Song of Solomon (Oprah's Book Club (Paperback))
Beloved (Plume Contemporary Fiction),The Weight of Water : A Novel Tag: Author of Resistance and Strange Fits of Passion,The English Patient,The Witching Hour (Lives of the Mayfair Witches),The Bonesetter's Daughter,Watership Down
Betrayal in Death,Portrait in Death,Macgregor Brides (Macgregors),Night Whispers,Purity in Death,The Reef
Big Stone Gap: A Novel (Ballantine Reader's Circle),Empire Falls,The Stone Diaries,Sea Glass: A Novel,Blessings,The Honk and Holler Opening Soon
Big Trouble,A Widow for One Year,The No. 1 Ladies' Detective Agency (Today Show Book Club #8),Coraline,A Man in Full,Naked
Billy Straight : A Novel,Deja Dead,Degree of Guilt,Death du Jour,Deck the Halls (Holiday Classics),Unnatural Exposure
Birthright,Key of Knowledge (Key Trilogy (Paperback)),Dangerous,Midnight Bayou,The Reef,Three Fates
Bittersweet,The Long Road Home,Eyes of a Child,The Rainmaker,Kaleidoscope,Exclusive
Black House,"Wizard and Glass (The Dark Tower, Book 4)","The Gunslinger (The Dark Tower, Book 1)",Desperation,"The Drawing of the Three (The Dark Tower, Book 2)",Everything's Eventual : 14 Dark Tales
Black Notice,Point of Origin,Unnatural Exposure,The Last Precinct,Guilty as Sin,The Body Farm
Black and Blue,Blessings,Jewel,Fortune's Rocks : A Novel,Seven Habits Of Highly Effective People,Sea Glass: A Novel
Bleachers,Cry Wolf,The Edge,Journey,The King of Torts,Kaleidoscope
Blessings,One True Thing,The Dogs of Babel (Today Show Book Club #12),Black and Blue,Echoes,The God of Small Things
Blood Work,Slammerkin,Empire Falls,Envy,The Angel of Darkness,Harvest
Blue Diary,A Man Named Dave: A Story of Triumph and Forgiveness,Sea Glass: A Novel,Turtle Moon,The Hours: A Novel,Where the Heart Is (Oprah's Book Club (Paperback))
Body of Evidence (Kay Scarpetta Mysteries (Paperback)),All That Remains (Kay Scarpetta Mysteries (Paperback)),Shadow Prey,Cruel &amp; Unusual (Kay Scarpetta Mysteries (Paperback)),Night Prey,Mind Prey
Body of Lies,Night Sins,Final Target,The Search,The Face of Deception,The Sands of Time
Brave New World,1984,How to Be Good,Naked,Five Quarters of the Orange,Love in the Time of Cholera (Penguin Great Books of the 20th Century)
"Breath, Eyes, Memory",Drowning Ruth,"River, Cross My Heart",Song of Solomon (Oprah's Book Club (Paperback)),Jewel,While I Was Gone
Breathing Lessons,The Crimson Petal and the White,Seabiscuit: An American Legend,The Hours : A Novel,Absolute Power,Secrets
Bridge to Terabithia,Anne of the Island,The Giver (21st Century Reference),The Ugly Duckling,Midnight in the Garden of Good and Evil,Secrets
Bridget Jones : The Edge of Reason,Ladder of Years,The Glass Lake,The Reader,A Day Late and a Dollar Short,Naked
Bridget Jones's Diary,Bridget Jones: The Edge of Reason,The Bridges of Madison County,Zoya,Girl in Hyacinth Blue,How to Make an American Quilt
Bridget Jones: The Edge of Reason,Bridget Jones's Diary,"Girl, Interrupted",The Hundred Secret Senses,The Hours : A Novel,Watermelon
By the Light of the Moon,One Door Away from Heaven,Seize the Night,Whispers,Dragon Tears,Daddy's Little Girl
C Is for Corpse (Kinsey Millhone Mysteries (Paperback)),K Is for Killer (Kinsey Millhone Mysteries (Paperback)),I Is for Innocent,H Is for Homicide (Kinsey Millhone Mysteries (Paperback)),B Is for Burglar (Kinsey Millhone Mysteries (Paperback)),E Is for Evidence: A Kinsey Millhone Mystery (Kinsey Millhone Mysteries (Paperback))
CAT'S EYE,Prime Cut,Irish Hearts,Unspeakable,Fingersmith,Secret History
Call of the Wild,The Lottery Winner : Alvirah And Willy Stories,Invasion,Postmortem,A Civil Action,The Temple of My Familiar
Carnal Innocence,Homeport,Montana Sky,Sanctuary,The Reef,Dance upon the Air (Three Sisters Island Trilogy)
Carolina Moon,The Reef,Dance upon the Air (Three Sisters Island Trilogy),Key of Knowledge (Key Trilogy (Paperback)),Heaven and Earth (Three Sisters Island Trilogy),Sacred Sins
Carrie,Bag of Bones,Gerald's Game,The Dark Half,Insomnia,Rose Madder
Cat &amp; Mouse (Alex Cross Novels),Hide &amp; Seek,Exclusive,"Loves Music, Loves to Dance",Nothing Lasts Forever,Eyes of a Child
Catering to Nobody,Exclusive,The First Counsel,Fine Things,Dying for Chocolate (Culinary Mysteries (Paperback)),Hornet's Nest
Cause of Death,Unnatural Exposure,Exclusive,The Body Farm,Cruel &amp; Unusual (Kay Scarpetta Mysteries (Paperback)),All That Remains (Kay Scarpetta Mysteries (Paperback))
Certain Prey,Chosen Prey,Shadow Prey,Night Prey,The Burden of Proof,Hornet's Nest
Charlotte's Web (Trophy Newbery),Exclusive,Possession : A Romance,Harry Potter and the Prisoner of Azkaban (Book 3),Harry Potter and the Chamber of Secrets (Book 2),"The Two Towers (The Lord of the Rings, Part 2)"
Charming Billy,A Thousand Acres (Ballantine Reader's Circle),Vinegar Hill (Oprah's Book Club (Paperback)),The Rapture of Canaan,Plainsong (Vintage Contemporaries),While I Was Gone
Chicken Soup for the Soul (Chicken Soup for the Soul),Jewel (Oprah's Book Club),Don't Sweat the Small Stuff and It's All Small Stuff : Simple Ways to Keep the Little Things from Taking Over Your Life (Don't Sweat the Small Stuff Series),At Home in Mitford (The Mitford Years),River's End,Shell Seekers
Chicken Soup for the Woman's Soul (Chicken Soup for the Soul Series (Paper)),Ellen Foster,A Lesson Before Dying (Vintage Contemporaries (Paperback)),Secrets,Night Whispers,The Mulberry Tree
Chocolat,Five Quarters of the Orange,Unnatural Exposure,The Secret Garden,Hideaway,All I Really Need to Know
Choke,Flesh and Blood,The Murder Book,Isle of Dogs,The Blind Assassin,Animal Dreams
Chosen Prey,Mortal Prey,Easy Prey,Mind Prey,Eyes of a Child,The Dogs of Babel (Today Show Book Club #12)
Christine,Cujo,Pet Sematary,It,Watchers,Needful Things
Chromosome 6,Acceptable Risk,Invasion,Vector,The Hot Zone,Harvest
Circle of Friends,The Glass Lake,GARDEN OF SHADOWS (Dollanger Saga (Paperback)),Nights in Rodanthe,Granny Dan,Dark Angel
Clear and Present Danger (Jack Ryan Novels),Red Storm Rising,Rainbow Six,Patriot Games (Jack Ryan Novels),Debt of Honor (Jack Ryan Novels),The Hunt for Red October
Cold Mountain,Fried Green Tomatoes at the Whistle Stop Cafe,A Great Deliverance,Death du Jour,Mystic River,Cry Wolf
Cold Mountain : A Novel,Three Junes,STONES FROM THE RIVER,Empire Falls,Animal Dreams,Seabiscuit: An American Legend
Cold Sassy Tree,The Copper Beech,Under the Tuscan Sun,At Home in Mitford (The Mitford Years),A Map of the World,Jacob Have I Loved
Colony,Harvest,Exclusive,Envy,Nothing Lasts Forever,The Copper Beech
Coming Home,Winter Solstice,Shell Seekers,Devices and Desires,Tara Road,The Last Precinct
Confessions of a Shopaholic (Summer Display Opportunity),Shopaholic Takes Manhattan (Summer Display Opportunity),The Devil Wears Prada : A Novel,In Her Shoes : A Novel,The Nanny Diaries: A Novel,Shopaholic Ties the Knot
Confessions of an Ugly Stepsister : A Novel,Wicked: The Life and Times of the Wicked Witch of the West,Empire Falls,The Eyre Affair: A Novel,Tears of the Giraffe (No.1 Ladies Detective Agency),Peace Like a River
Congo,Postmortem,Jacob Have I Loved,Clear and Present Danger (Jack Ryan Novels),Strangers,The Firm
Contact,"The Gunslinger (The Dark Tower, Book 1)",Fatal Cure,Stupid White Men ...and Other Sorry Excuses for the State of the Nation!,Dreamcatcher,Black House
Contagion,Fatal Cure,Vector,Family Album,Mr. Murder,From the Corner of His Eye
Coraline,A Year in Provence,Fingersmith,A Wrinkle In Time,Notes from a Small Island,Me Talk Pretty One Day
Couplehood,The Virgin Suicides,A Civil Action,Confessions of an Ugly Stepsister : A Novel,No Safe Place,A Patchwork Planet
Cradle and All,We'll Meet Again,Four Blind Mice,Fat Tuesday,The Client,Jack &amp; Jill (Alex Cross Novels)
Crazy for You,Now You See Her,Dangerous,Faking It,The Bachelor (Warner Books Contemporary Romance),Heartbreaker
Cruel &amp; Unusual (Kay Scarpetta Mysteries (Paperback)),All That Remains (Kay Scarpetta Mysteries (Paperback)),The Body Farm,From Potter's Field,Point of Origin,The Clinic (Alex Delaware Novels (Paperback))
Cry Wolf,The Edge,Night Sins,Montana Sky,A Thin Dark Line (Mysteries &amp; Horror),The Reef
Cujo,Pet Sematary,It,Christine,Skeleton Crew,Desperation
D Is for Deadbeat (Kinsey Millhone Mysteries (Paperback)),K Is for Killer (Kinsey Millhone Mysteries (Paperback)),E Is for Evidence: A Kinsey Millhone Mystery (Kinsey Millhone Mysteries (Paperback)),B Is for Burglar (Kinsey Millhone Mysteries (Paperback)),H Is for Homicide (Kinsey Millhone Mysteries (Paperback)),G Is for Gumshoe (Kinsey Millhone Mysteries (Paperback))
Daddy,Accident,Message from Nam,Fine Things,Vanished,Heartbeat
Daddy's Little Girl,You Belong To Me,Family Album,I'll Be Seeing You,We'll Meet Again,Moonlight Becomes You
Daisy Fay and the Miracle Man,How to Make an American Quilt,"Welcome to the World, Baby Girl!",No Safe Place,Midnight in the Garden of Good and Evil,White Oleander : A Novel (Oprah's Book Club)
Dance upon the Air (Three Sisters Island Trilogy),Heaven and Earth (Three Sisters Island Trilogy),Face the Fire (Three Sisters Island Trilogy),Purity in Death,Carolina Moon,Macgregor Brides (Macgregors)
Dances With Wolves,The Thorn Birds,Wuthering Heights,Primary Colors: A Novel of Politics,I'll Be Seeing You,The Testament
Dangerous,Birthright,Killjoy,Temptation,Family Album,"Forever... : A Novel of Good and Evil, Love and Hope"
Dark Angel,River's End,Midnight Bayou,Sanctuary,Carnal Innocence,GARDEN OF SHADOWS (Dollanger Saga (Paperback))
Dark Paradise,Night Sins,Family Album,Guilty as Sin,Homeport,We'll Meet Again
Dark Rivers of the Heart,The Bad Place,Midnight,Icebound,While My Pretty One Sleeps,Lightning
Dawn (Cutler),Message from Nam,The Long Road Home,Five Days in Paris,Fine Things,Kaleidoscope
Death du Jour,A Great Deliverance,The Last Precinct,Tara Road,Deja Dead,Over the Edge
Debt of Honor (Jack Ryan Novels),The Cardinal of the Kremlin (Jack Ryan Novels),Clear and Present Danger (Jack Ryan Novels),The Sum of All Fears (Jack Ryan Novels),Without Remorse,The First Counsel
Deception Point,Chosen Prey,Touching Evil,Harvest,Exclusive,Last Man Standing
Deck the Halls (Holiday Classics),Range of Motion,Exclusive,The Cradle Will Fall,On the Street Where You Live,I'll Be Seeing You
Degree of Guilt,WLD ACCORDNG GARP,All That Remains (Kay Scarpetta Mysteries (Paperback)),Remember Me,We'll Meet Again,Shadow Prey
Deja Dead,Billy Straight : A Novel,Winter Solstice,Death du Jour,Exclusive,The Body Farm
Desperation,Rose Madder,Four Past Midnight,Black House,Dreamcatcher,Insomnia
Devices and Desires,Coming Home,Winter Solstice,Remember Me,The Sum of All Fears (Jack Ryan Novels),The Last Precinct
Different Seasons,The Regulators,The Tommyknockers,It,Four Past Midnight,"Wizard and Glass (The Dark Tower, Book 4)"
Digital Fortress : A Thriller,Morality for Beautiful Girls (No.1 Ladies Detective Agency),A Prayer for Owen Meany,The Woman Next Door,Balzac and the Little Chinese Seamstress : A Novel,Zoya
Disclosure,Plum Island,The Street Lawyer,A Day Late and a Dollar Short,From Potter's Field,The Celestine Prophecy (Celestine Prophecy)
Divine Secrets of the Ya-Ya Sisterhood: A Novel,Girl in Hyacinth Blue,The Red Tent (Bestselling Backlist),The Nanny Diaries: A Novel,The Secret Life of Bees,Blue Diary
Dolores Claiborne,From the Corner of His Eye,Rose Madder,Watchers,Toxin,Gerald's Game
Don't Stand Too Close to a Naked Man,The First Counsel,Tis: A Memoir,Politically Correct Bedtime Stories: Modern Tales for Our Life and Times,A Lesson Before Dying (Vintage Contemporaries (Paperback)),Exclusive
Don't Sweat the Small Stuff and It's All Small Stuff : Simple Ways to Keep the Little Things from Taking Over Your Life (Don't Sweat the Small Stuff Series),Chicken Soup for the Soul (Chicken Soup for the Soul),A Map of the World,Nights in Rodanthe,Icy Sparks,The Hours : A Novel
Dr. Atkins' New Diet Revolution,The Pull of the Moon,Dragonfly in Amber,Turtle Moon,Family Album,Contagion
Dragon Tears,Hideaway,While My Pretty One Sleeps,Before I Say Good-Bye,"Loves Music, Loves to Dance",Rose Madder
Dragonfly in Amber,Drums of Autumn,Voyager,Outlander,Falling Angels,Echoes
Dream Country,The Reef,Carolina Moon,Key of Knowledge (Key Trilogy (Paperback)),The Summerhouse,Rising Tides
Dreamcatcher,Desperation,Four Past Midnight,Black House,Bag of Bones,The Dark Half
Drowning Ruth,The Reader,"Breath, Eyes, Memory",Song of Solomon (Oprah's Book Club (Paperback)),Angela's Ashes: A Memoir,The Celestine Prophecy (Celestine Prophecy)
Drowning Ruth (Oprah's Book Club),The Last Time They Met : A Novel,Vinegar Hill (Oprah's Book Club (Paperback)),House of Sand and Fog,We Were the Mulvaneys,The Pilot's Wife : A Novel
Drums of Autumn,Dragonfly in Amber,Voyager,Outlander,The Horse Whisperer,Falling Angels
"Dude, Where's My Country?",The Robber Bride,The Hundred Secret Senses,Stupid White Men ...and Other Sorry Excuses for the State of the Nation!,The Blind Assassin,The Phantom Tollbooth
Dust to Dust,The Killing Game: Only One Can Win...and the Loser Dies,Nothing Lasts Forever,Night Sins,Unnatural Exposure,The Face of Deception
Dying for Chocolate (Culinary Mysteries (Paperback)),Three To Get Deadly : A Stephanie Plum Novel (A Stephanie Plum Novel),Catering to Nobody,From Potter's Field,Prime Cut,The Body Farm
E Is for Evidence: A Kinsey Millhone Mystery (Kinsey Millhone Mysteries (Paperback)),I Is for Innocent,H Is for Homicide (Kinsey Millhone Mysteries (Paperback)),D Is for Deadbeat (Kinsey Millhone Mysteries (Paperback)),F Is for Fugitive (Kinsey Millhone Mysteries (Paperback)),K Is for Killer (Kinsey Millhone Mysteries (Paperback))
Easy Prey,Chosen Prey,Mortal Prey,Sudden Prey,Flesh and Blood,Night Prey
Echoes,The Glass Lake,Angela's Ashes (MMP) : A Memoir,The Return Journey,Harvest,The Copper Beech
Ellen Foster,Chicken Soup for the Woman's Soul (Chicken Soup for the Soul Series (Paper)),The Mulberry Tree,The Glass Lake,What Looks Like Crazy On An Ordinary Day,Dark Angel
Empire Falls,Tears of the Giraffe (No.1 Ladies Detective Agency),A Prayer for Owen Meany,Confessions of an Ugly Stepsister : A Novel,Blood Work,She's Come Undone (Oprah's Book Club (Paperback))
Ender's Game (Ender Wiggins Saga (Paperback)),Love in the Time of Cholera (Penguin Great Books of the 20th Century),Hearts in Atlantis,Absolute Power,The First Counsel,Don't Stand Too Close to a Naked Man
Engaging The Enemy,Message from Nam,"Truly, Madly Manhattan",Summer Pleasures,Jewels of the Sun (Irish Trilogy),Fine Things
Envy,Final Target,Homeport,Midnight Bayou,Touching Evil,Sanctuary
Evening Class,Scarlet Feather,The Copper Beech,Tara Road,Winter Solstice,The Return Journey
Everything's Eventual : 14 Dark Tales,Desperation,Nightmares &amp; Dreamscapes,Black House,"Wizard and Glass (The Dark Tower, Book 4)",The Tommyknockers
Exclusive,The Long Road Home,Eyes of a Child,Fine Things,Secrets,The Cradle Will Fall
Executive Orders (Jack Ryan Novels),The Cardinal of the Kremlin (Jack Ryan Novels),The Sum of All Fears (Jack Ryan Novels),Patriot Games (Jack Ryan Novels),Without Remorse,Rainbow Six
Eyes of a Child,Exclusive,The Cradle Will Fall,Fine Things,Secrets,The Long Road Home
F Is for Fugitive (Kinsey Millhone Mysteries (Paperback)),G Is for Gumshoe (Kinsey Millhone Mysteries (Paperback)),I Is for Innocent,B Is for Burglar (Kinsey Millhone Mysteries (Paperback)),E Is for Evidence: A Kinsey Millhone Mystery (Kinsey Millhone Mysteries (Paperback)),H Is for Homicide (Kinsey Millhone Mysteries (Paperback))
FORREST GUMP (Movie Tie in),Couplehood,Slow Waltz in Cedar Bend,Lake Wobegon Days,The Rainmaker,The Giver (21st Century Reference)
Face the Fire (Three Sisters Island Trilogy),Heaven and Earth (Three Sisters Island Trilogy),Dance upon the Air (Three Sisters Island Trilogy),Purity in Death,The Reef,Macgregor Brides (Macgregors)
