,1st,2nd,3rd,4th,5th
Nightmares &amp; Dreamscapes,Rose Madder,Four Past Midnight,The Dark Half,Insomnia,Everything's Eventual : 14 Dark Tales
Nights in Rodanthe,The Mulberry Tree,Dark Angel,A Walk to Remember,GARDEN OF SHADOWS (Dollanger Saga (Paperback)),The Wedding
No Greater Love,Five Days in Paris,The Long Road Home,Heartbeat,Message from Nam,Daddy
No Safe Place,A Civil Action,Silent Witness,The Temple of My Familiar,A Thousand Acres (Ballantine Reader's Circle),Family Album
Notes from a Small Island,High Fidelity,How to Be Good,About a Boy,Blessings,Coraline
Nothing Lasts Forever,Dust to Dust,Fat Tuesday,Cat &amp; Mouse (Alex Cross Novels),Colony,Eyes of a Child
Now You See Her,Crazy for You,The Witness,Suzanne's Diary for Nicholas,The Most Wanted,Irish Hearts
On the Street Where You Live,Weep No More My Lady,I'll Be Seeing You,You Belong To Me,While My Pretty One Sleeps,Exclusive
One Door Away from Heaven,By the Light of the Moon,Everything's Eventual : 14 Dark Tales,Fear Nothing,Pet Sematary,Midnight
One True Thing,Blessings,The Poisonwood Bible,Girl with a Pearl Earring,Evening Class,STONES FROM THE RIVER
One for the Money (A Stephanie Plum Novel),Two for the Dough,Four To Score (A Stephanie Plum Novel),Three To Get Deadly : A Stephanie Plum Novel (A Stephanie Plum Novel),Hard Eight : A Stephanie Plum Novel (A Stephanie Plum Novel),High Five (A Stephanie Plum Novel)
One for the Money (Stephanie Plum Novels (Paperback)),Night Whispers,Two for the Dough,Midwives: A Novel,Exclusive,Midnight in the Garden of Good and Evil
Oryx and Crake,Presumed Innocent,The Girl Who Loved Tom Gordon,The Crimson Petal and the White,No Safe Place,Life of Pi
Outlander,Voyager,Drums of Autumn,Dragonfly in Amber,Fortune's Rocks: A Novel,Falling Angels
Over the Edge,Last Man Standing,Mortal Prey,Harvest,Mind Prey,Chosen Prey
P Is for Peril,D Is for Deadbeat (Kinsey Millhone Mysteries (Paperback)),B Is for Burglar (Kinsey Millhone Mysteries (Paperback)),H Is for Homicide (Kinsey Millhone Mysteries (Paperback)),G Is for Gumshoe (Kinsey Millhone Mysteries (Paperback)),K Is for Killer (Kinsey Millhone Mysteries (Paperback))
Paradise,Killjoy,Welcome to Temptation,Macgregor Brides (Macgregors),Night Whispers,The Villa
Patriot Games (Jack Ryan Novels),The Cardinal of the Kremlin (Jack Ryan Novels),Clear and Present Danger (Jack Ryan Novels),Executive Orders (Jack Ryan Novels),The Hunt for Red October,Without Remorse
Pay It Forward,Hearts in Atlantis,Wild Animus,A Walk to Remember,Foucault's Pendulum,Saving Faith
Peace Like a River,Midwives: A Novel,Wicked: The Life and Times of the Wicked Witch of the West,Confessions of an Ugly Stepsister : A Novel,House of Sand and Fog,One for the Money (Stephanie Plum Novels (Paperback))
Pet Sematary,Cujo,It,Insomnia,Skeleton Crew,Needful Things
Phantoms,Whispers,Pet Sematary,GARDEN OF SHADOWS (Dollanger Saga (Paperback)),Fear Nothing,Skeleton Crew
Pigs in Heaven,Love in the Time of Cholera (Penguin Great Books of the 20th Century),The Poisonwood Bible,A Thousand Acres (Ballantine Reader's Circle),Midnight in the Garden of Good and Evil,A Man Named Dave: A Story of Triumph and Forgiveness
Plainsong (Vintage Contemporaries),Three Junes,Moo,Charming Billy,Midnight in the Garden of Good and Evil: A Savannah Story,A Heartbreaking Work of Staggering Genius
Pleading Guilty,Absolute Power,Rainbow Six,Wuthering Heights,The Girl Who Loved Tom Gordon,Drums of Autumn
Plum Island,Disclosure,Point of Origin,A Man in Full,Exclusive,All That Remains (Kay Scarpetta Mysteries (Paperback))
Point of Origin,Black Notice,Cruel &amp; Unusual (Kay Scarpetta Mysteries (Paperback)),The Body Farm,Unnatural Exposure,Plum Island
Politically Correct Bedtime Stories: Modern Tales for Our Life and Times,Don't Stand Too Close to a Naked Man,Saving Faith,Into Thin Air : A Personal Account of the Mt. Everest Disaster,Saint Maybe,L Is for Lawless
Pop Goes the Weasel,The Clinic (Alex Delaware Novels (Paperback)),1st to Die: A Novel,Cat &amp; Mouse (Alex Cross Novels),The Woman Next Door,The Summons
Portrait in Death,Purity in Death,Macgregor Brides (Macgregors),Night Whispers,Sacred Sins,The Reef
Possession : A Romance,"The Reptile Room (A Series of Unfortunate Events, Book 2)",Charlotte's Web (Trophy Newbery),Fingersmith,The Eyre Affair: A Novel,The Carousel
Postmortem,The Clinic (Alex Delaware Novels (Paperback)),The Poisonwood Bible,Cruel &amp; Unusual (Kay Scarpetta Mysteries (Paperback)),Exclusive,Unnatural Exposure
Practical Magic,The Celestine Prophecy (Celestine Prophecy),You Belong To Me,Final Target,The Book of Ruth (Oprah's Book Club (Paperback)),All Around the Town
Presumed Innocent,Oryx and Crake,The Cardinal of the Kremlin (Jack Ryan Novels),A Civil Action,Watchers,Long After Midnight
Pretend You Don't See Her,Before I Say Good-Bye,We'll Meet Again,My Gal Sunday,While My Pretty One Sleeps,Daddy's Little Girl
Pride and Prejudice,The English Patient,How to Be Good,Two for the Dough,Rising Sun,4 Blondes
Primary Colors: A Novel of Politics,Wuthering Heights,Dances With Wolves,Cold Mountain,Digital Fortress : A Thriller,Pleading Guilty
Prime Cut,Dying for Chocolate (Culinary Mysteries (Paperback)),CAT'S EYE,One for the Money (Stephanie Plum Novels (Paperback)),The Bachelor (Warner Books Contemporary Romance),Hard Eight : A Stephanie Plum Novel (A Stephanie Plum Novel)
Prodigal Summer,Zen and the Art of Motorcycle Maintenance: An Inquiry into Values,The Poisonwood Bible,Love in the Time of Cholera (Penguin Great Books of the 20th Century),The Bonesetter's Daughter,The Fourth Hand
Purity in Death,Portrait in Death,Macgregor Brides (Macgregors),The Reef,Sacred Sins,Dance upon the Air (Three Sisters Island Trilogy)
Q Is for Quarry,"\O\"" Is for Outlaw""",Last Man Standing,The Face of Deception,P Is for Peril,D Is for Deadbeat (Kinsey Millhone Mysteries (Paperback))
Rainbow Six,Clear and Present Danger (Jack Ryan Novels),The Cardinal of the Kremlin (Jack Ryan Novels),Red Storm Rising,Sudden Prey,Without Remorse
Range of Motion,The Pull of the Moon,Deck the Halls (Holiday Classics),Fine Things,STONES FROM THE RIVER,The Last Time They Met : A Novel
Rebecca,The Edge,Cry Wolf,Fried Green Tomatoes at the Whistle Stop Cafe,I Capture the Castle,Schindler's List
Red Dragon,Hannibal,Silence of the Lambs,Red Storm Rising,Jurassic Park,Point of Origin
Red Storm Rising,Clear and Present Danger (Jack Ryan Novels),Rainbow Six,The Sum of All Fears (Jack Ryan Novels),Debt of Honor (Jack Ryan Novels),Patriot Games (Jack Ryan Novels)
Remember Me,The Cradle Will Fall,Exclusive,Before I Say Good-Bye,Let Me Call You Sweetheart,The Witness
Riptide,Night Whispers,Portrait in Death,Face the Fire (Three Sisters Island Trilogy),Macgregor Brides (Macgregors),The Reef
Rising Sun,Jurassic Park,The Bonfire of the Vanities,Fatal Cure,The Princess Bride: S Morgenstern's Classic Tale of True Love and High Adventure,Sphere
Rising Tides,Inner Harbor (Quinn Brothers (Paperback)),Sea Swept (Quinn Brothers (Paperback)),The Reef,Heart of the Sea (Irish Trilogy),Stanislaski Brothers (Silhouette Promo)
River's End,Sanctuary,Midnight Bayou,Heart of the Sea (Irish Trilogy),Jewels of the Sun (Irish Trilogy),Macgregor Brides (Macgregors)
"River, Cross My Heart",Jewel,We Were the Mulvaneys,House of Sand and Fog,Vinegar Hill (Oprah's Book Club (Paperback)),A Lesson Before Dying (Vintage Contemporaries (Paperback))
Rose Madder,Four Past Midnight,The Regulators,It,Insomnia,Desperation
Roses Are Red (Alex Cross Novels),Kiss the Girls,Violets Are Blue,1st to Die: A Novel,The Murder Book,Pop Goes the Weasel
Rules of Prey,Night Prey,Mind Prey,Shadow Prey,The Door to December,All That Remains (Kay Scarpetta Mysteries (Paperback))
SHIPPING NEWS,The Phantom Tollbooth,A Map of the World,The Alchemist: A Fable About Following Your Dream,The Weight of Water : A Novel Tag: Author of Resistance and Strange Fits of Passion,Ladder of Years
STONES FROM THE RIVER,Range of Motion,The Book of Ruth (Oprah's Book Club (Paperback)),Vinegar Hill (Oprah's Book Club (Paperback)),Cold Mountain : A Novel,The Pull of the Moon
Sacred Sins,The Reef,Portrait in Death,Purity in Death,Key of Knowledge (Key Trilogy (Paperback)),Macgregor Brides (Macgregors)
Saint Maybe,Here on Earth,Ladder of Years,How to Be Good,The Honk and Holler Opening Soon,I Know This Much Is True
Sanctuary,River's End,Homeport,Carnal Innocence,Sea Swept (Quinn Brothers (Paperback)),Midnight Bayou
Saving Faith,Last Man Standing,The Sweet Potato Queens' Book of Love,C Is for Corpse (Kinsey Millhone Mysteries (Paperback)),Harvest,Hearts in Atlantis
Scarlet Feather,Evening Class,Tara Road,Winter Solstice,The Return Journey,The Copper Beech
"Scarlett : The Sequel to Margaret Mitchell's \Gone With the Wind\""""",The Plains of Passage (Earth's Children (Paperback)),Fine Things,Fat Tuesday,Seven Habits Of Highly Effective People,Jacob Have I Loved
Schindler's List,The Temple of My Familiar,The Diary of Ellen Rimbauer: My Life at Rose Red,"Scarlett : The Sequel to Margaret Mitchell's \Gone With the Wind\""""",ANGELA'S ASHES,Rebecca
Sea Glass: A Novel,I Know This Much Is True,Nights in Rodanthe,Blue Diary,The Clan of the Cave Bear (Earth's Children (Paperback)),The Hours: A Novel
Sea Swept (Quinn Brothers (Paperback)),Inner Harbor (Quinn Brothers (Paperback)),Rising Tides,Heart of the Sea (Irish Trilogy),Sanctuary,The Reef
Seabiscuit,I Capture the Castle,The Hundred Secret Senses,Midnight in the Garden of Good and Evil,The Mulberry Tree,Midwives: A Novel
Seabiscuit: An American Legend,The Weight of Water : A Novel Tag: Author of Resistance and Strange Fits of Passion,Holes (Yearling Newbery),Breathing Lessons,Slammerkin,The Blind Assassin
Second Nature,Hearts in Atlantis,"All the Pretty Horses (The Border Trilogy, Vol 1)",Exclusive,Pop Goes the Weasel,I Know This Much Is True (Oprah's Book Club)
Secret History,The Alienist,Ladder of Years,The Blind Assassin,Balzac and the Little Chinese Seamstress : A Novel,Bastard Out of Carolina
Secrets,Fine Things,Kaleidoscope,Zoya,Exclusive,Message from Nam
Seize the Night,Fear Nothing,By the Light of the Moon,Winter Moon,One Door Away from Heaven,The Bad Place
Seven Habits Of Highly Effective People,"Scarlett : The Sequel to Margaret Mitchell's \Gone With the Wind\""""",Black and Blue,Little Altars Everywhere: A Novel,Welcome to Temptation,Vinegar Hill (Oprah's Book Club (Paperback))
Seven Up (A Stephanie Plum Novel),Hard Eight : A Stephanie Plum Novel (A Stephanie Plum Novel),Four To Score (A Stephanie Plum Novel),High Five (A Stephanie Plum Novel),Three To Get Deadly : A Stephanie Plum Novel (A Stephanie Plum Novel),To the Nines: A Stephanie Plum Novel
Shadow Prey,Night Prey,Rules of Prey,Body of Evidence (Kay Scarpetta Mysteries (Paperback)),H Is for Homicide (Kinsey Millhone Mysteries (Paperback)),All That Remains (Kay Scarpetta Mysteries (Paperback))
Shadowfires,Winter Moon,Midnight,Fear Nothing,Lightning,Dark Rivers of the Heart
Shattered,Whispers,Beach House,Hemlock Bay,By the Light of the Moon,Shadowfires
She's Come Undone (Oprah's Book Club (Paperback)),Empire Falls,Bastard Out of Carolina,Animal Dreams,I Know This Much Is True,Middlesex: A Novel
She's Come Undone (Oprah's Book Club),We Were the Mulvaneys,The Bonesetter's Daughter,White Oleander : A Novel,C Is for Corpse (Kinsey Millhone Mysteries (Paperback)),N Is for Noose
Shell Seekers,Coming Home,Winter Solstice,Chicken Soup for the Soul (Chicken Soup for the Soul),Echoes,Montana Sky
Shopaholic Takes Manhattan (Summer Display Opportunity),Shopaholic Ties the Knot,The Devil Wears Prada : A Novel,Confessions of a Shopaholic (Summer Display Opportunity),Tara Road,Wanderlust
Shopaholic Ties the Knot,Shopaholic Takes Manhattan (Summer Display Opportunity),Jack &amp; Jill (Alex Cross Novels),Confessions of a Shopaholic (Summer Display Opportunity),While My Pretty One Sleeps,Tara Road
Sick Puppy,Final Target,Skeleton Crew,Shadowfires,The Tommyknockers,Plum Island
Silence of the Lambs,Red Dragon,"The Vampire Lestat (Vampire Chronicles, Book II)","Wizard and Glass (The Dark Tower, Book 4)",Desperation,E Is for Evidence: A Kinsey Millhone Mystery (Kinsey Millhone Mysteries (Paperback))
Silent Witness,Exclusive,Hornet's Nest,The Clinic (Alex Delaware Novels (Paperback)),Violets Are Blue,Cause of Death
Skeleton Crew,The Tommyknockers,The Dark Half,Pet Sematary,It,The Regulators
Skipping Christmas,Fine Things,The Wedding,Night Whispers,Kaleidoscope,Fall On Your Knees (Oprah #45)
Slammerkin,Blood Work,Sacred Sins,Montana Sky,Cry Wolf,Midnight in the Garden of Good and Evil
Sleepers,Everything's Eventual : 14 Dark Tales,No Safe Place,"The Drawing of the Three (The Dark Tower, Book 2)",Pride and Prejudice,Brave New World
Slow Waltz in Cedar Bend,The Woman Next Door,It's Always Something,The Carousel,Vinegar Hill (Oprah's Book Club (Paperback)),The Glass Lake
Small Town Girl,That Camden Summer,Night Whispers,The Jester,The Mulberry Tree,Midnight Bayou
Smart Women,Wifey,The Killing Game: Only One Can Win...and the Loser Dies,Fatal Cure,Summer Sisters,The Glass Lake
Smilla's Sense of Snow,"All the Pretty Horses (The Border Trilogy, Vol 1)",Hearts in Atlantis,Harvest,Chromosome 6,Unspeakable
Snow Falling on Cedars,While I Was Gone,Cry Wolf,The Secret Life of Bees,Charming Billy,How Stella Got Her Groove Back
Sole Survivor,Hideaway,Dark Rivers of the Heart,I'll Be Seeing You,Before I Say Good-Bye,Whispers
Song of Solomon (Oprah's Book Club (Paperback)),"Breath, Eyes, Memory",Drowning Ruth,The God of Small Things,Mother of Pearl,Beloved
Songs in Ordinary Time (Oprah's Book Club (Paperback)),Vinegar Hill (Oprah's Book Club (Paperback)),While I Was Gone,Jewel,The Reader,Sea Glass: A Novel
Sophie's World: A Novel About the History of Philosophy,Bastard Out of Carolina,Tales of a Fourth Grade Nothing,How Stella Got Her Groove Back,Suzanne's Diary for Nicholas,"Men Are from Mars, Women Are from Venus: A Practical Guide for Improving Communication and Getting What You Want in Your Relationships"
Southern Cross,Isle of Dogs,Cruel &amp; Unusual (Kay Scarpetta Mysteries (Paperback)),The Clinic (Alex Delaware Novels (Paperback)),The Body Farm,Shadow Prey
Sphere,Airframe,Absolute Power,Jurassic Park,"Welcome to the World, Baby Girl!",A Man in Full
Standoff,Unspeakable,The Summerhouse,Sacred Sins,The Woman Next Door,Ashes to Ashes
Stanislaski Brothers (Silhouette Promo),Tears of the Moon (Irish Trilogy),Macgregor Brides (Macgregors),Midnight Bayou,The Reef,Rising Tides
Still Waters,Night Sins,Mortal Prey,When the Wind Blows,The Face of Deception,Cry Wolf
Stillwatch,You Belong To Me,I'll Be Seeing You,"Loves Music, Loves to Dance",While My Pretty One Sleeps,Weep No More My Lady
Strangers,The Regulators,The Bad Place,Bag of Bones,The Tommyknockers,Hideaway
Stupid White Men ...and Other Sorry Excuses for the State of the Nation!,Contact,The Robber Bride,"Dude, Where's My Country?",Rising Sun,"Tuesdays with Morrie: An Old Man, a Young Man, and Life's Greatest Lesson"
Sudden Prey,Mind Prey,Eyes of a Child,Mortal Prey,Easy Prey,Hornet's Nest
Summer Pleasures,"Truly, Madly Manhattan",The Reef,Engaging The Enemy,Sacred Sins,Macgregor Brides (Macgregors)
Summer Sisters,Eyes of a Child,Wifey,Smart Women,Family Album,Wanderlust
Suzanne's Diary for Nicholas,The Most Wanted,Nights in Rodanthe,The Notebook,Now You See Her,The Lovely Bones: A Novel
Tales of a Fourth Grade Nothing,The Lottery Winner : Alvirah And Willy Stories,Gorky Park,F Is for Fugitive (Kinsey Millhone Mysteries (Paperback)),G Is for Gumshoe (Kinsey Millhone Mysteries (Paperback)),Carolina Moon
Taltos: Lives of the Mayfair Witches,Violin,The Tale of the Body Thief (Vampire Chronicles (Paperback)),The Queen of the Damned (Vampire Chronicles (Paperback)),The Witching Hour (Lives of the Mayfair Witches),No Safe Place
Tara Road,Scarlet Feather,Evening Class,Death du Jour,Echoes,Coming Home
Tears of the Giraffe (No.1 Ladies Detective Agency),The No. 1 Ladies' Detective Agency (Today Show Book Club #8),Morality for Beautiful Girls (No.1 Ladies Detective Agency),Empire Falls,Balzac and the Little Chinese Seamstress : A Novel,Confessions of an Ugly Stepsister : A Novel
Tears of the Moon (Irish Trilogy),Heart of the Sea (Irish Trilogy),Jewels of the Sun (Irish Trilogy),Stanislaski Brothers (Silhouette Promo),Inner Harbor (Quinn Brothers (Paperback)),Sea Swept (Quinn Brothers (Paperback))
Tell Me Lies (Tell Me Lies),The Partner,Crazy for You,The Runaway Jury,The Princess Bride: S Morgenstern's Classic Tale of True Love and High Adventure,The Mulberry Tree
Tell No One,The Next Accident,"The Gunslinger (The Dark Tower, Book 1)",Violets Are Blue,Whispers,Life of Pi
Temptation,Killjoy,Birthright,Dangerous,Heartbreaker,"Forever... : A Novel of Good and Evil, Love and Hope"
That Camden Summer,Small Town Girl,Night Whispers,Midnight Bayou,GARDEN OF SHADOWS (Dollanger Saga (Paperback)),Sacred Sins
The Accidental Tourist,Ladder of Years,Second Nature,The Return Journey,Coming Home,Echoes
The Alchemist: A Fable About Following Your Dream,The Witching Hour (Lives of the Mayfair Witches),SHIPPING NEWS,The Fourth Hand,The Loop,A Map of the World
The Alibi,The First Counsel,The Winner,The Switch,A Thin Dark Line (Mysteries &amp; Horror),False Memory
The Alienist,Cry Wolf,The Poisonwood Bible,The Cradle Will Fall,Secret History,The Angel of Darkness
"The Amber Spyglass (His Dark Materials, Book 3)","The Subtle Knife (His Dark Materials, Book 2)","The Golden Compass (His Dark Materials, Book 1)",The Eyre Affair: A Novel,A Fine Balance,"Like Water for Chocolate : A Novel in Monthly Installments with Recipes, Romances, and Home Remedies"
The Andromeda Strain,Colony,The Plains of Passage (Earth's Children (Paperback)),Wild Animus,"All the Pretty Horses (The Border Trilogy, Vol 1)",Smilla's Sense of Snow
The Angel of Darkness,I Know This Much Is True (Oprah's Book Club),A Man in Full,Blood Work,The Alienist,Love in the Time of Cholera (Penguin Great Books of the 20th Century)
The Bachelor (Warner Books Contemporary Romance),Fast Women,The Woman Next Door,Nerd in Shining Armor,Faking It,Fine Things
"The Bad Beginning (A Series of Unfortunate Events, Book 1)","The Reptile Room (A Series of Unfortunate Events, Book 2)",Chicken Soup for the Woman's Soul (Chicken Soup for the Soul Series (Paper)),Wicked: The Life and Times of the Wicked Witch of the West,"Angus, Thongs and Full-Frontal Snogging: Confessions of Georgia Nicolson",A Lesson Before Dying (Vintage Contemporaries (Paperback))
The Bad Place,Dark Rivers of the Heart,Strangers,Hideaway,The Door to December,The Tommyknockers
The Beach House,The Face of Deception,2nd Chance,The Woman Next Door,The Devil Wears Prada : A Novel,The First Counsel
The Bean Trees,Animal Dreams,Bel Canto: A Novel,She's Come Undone (Oprah's Book Club (Paperback)),Pigs in Heaven,To Kill a Mockingbird
The Blind Assassin,Midnight in the Garden of Good and Evil: A Savannah Story,Bastard Out of Carolina,Secret History,The Robber Bride,The Crimson Petal and the White
The Blue Nowhere : A Novel,Key of Knowledge (Key Trilogy (Paperback)),Body of Lies,Cat &amp; Mouse (Alex Cross Novels),Daddy's Little Girl,2nd Chance
The Body Farm,From Potter's Field,All That Remains (Kay Scarpetta Mysteries (Paperback)),Cruel &amp; Unusual (Kay Scarpetta Mysteries (Paperback)),Unnatural Exposure,Point of Origin
The Bonesetter's Daughter,The Kitchen God's Wife,The Hours : A Novel,The Red Tent (Bestselling Backlist),The Hundred Secret Senses,It Was on Fire When I Lay Down on It
The Bonfire of the Vanities,A Thousand Acres (Ballantine Reader's Circle),The Eyre Affair: A Novel,Rising Sun,"The Bad Beginning (A Series of Unfortunate Events, Book 1)",Jurassic Park
The Book of Ruth (Oprah's Book Club (Paperback)),STONES FROM THE RIVER,Here on Earth,The Lovely Bones: A Novel,Bastard Out of Carolina,Practical Magic
The Bourne Identity,The Pelican Brief,It's Always Something,The Partner,Secrets,The General's Daughter
The Bourne Supremacy,River's End,Homeport,The Bourne Ultimatum,Harvest,Dark Angel
The Bourne Ultimatum,The Copper Beech,The Bourne Supremacy,Homeport,Harvest,Fear Nothing
The Boy Next Door,In Her Shoes : A Novel,The Bachelor (Warner Books Contemporary Romance),Silent Witness,Key of Light (Key Trilogy (Paperback)),Nerd in Shining Armor
The Brethren,The Partner,The Testament,The Street Lawyer,A Painted House,The Pelican Brief
The Bridges of Madison County,Accident,Bridget Jones's Diary,That Camden Summer,Nights in Rodanthe,Mirror Image
The Burden of Proof,Jacob Have I Loved,Eyes of a Child,Nicolae: The Rise of Antichrist (Left Behind No. 3),The Genesis Code,The Fourth Hand
The Cardinal of the Kremlin (Jack Ryan Novels),Executive Orders (Jack Ryan Novels),Patriot Games (Jack Ryan Novels),Without Remorse,Debt of Honor (Jack Ryan Novels),Rainbow Six
The Carousel,The Woman Next Door,The Reader,The Wedding,The Copper Beech,Slow Waltz in Cedar Bend
The Catcher in the Rye,The Hitchhiker's Guide to the Galaxy,The Nanny Diaries: A Novel,A Wrinkle in Time,To Kill a Mockingbird,Tis: A Memoir
The Celestine Prophecy (Celestine Prophecy),Hearts in Atlantis,Winter Solstice,Practical Magic,The English Patient,The Poisonwood Bible
The Chamber,The Rainmaker,The Client,The Firm,The Street Lawyer,The Partner
The Cider House Rules,The English Patient,Girl in Hyacinth Blue,The God of Small Things,The Five People You Meet in Heaven,A Prayer for Owen Meany
The Clan of the Cave Bear (Earth's Children (Paperback)),The Valley of Horses,The Plains of Passage (Earth's Children (Paperback)),Sea Glass: A Novel,The Red Tent (Bestselling Backlist),"Scarlett : The Sequel to Margaret Mitchell's \Gone With the Wind\"""""
The Client,The Pelican Brief,The Chamber,A Time to Kill,The Rainmaker,The Firm
The Clinic (Alex Delaware Novels (Paperback)),H Is for Homicide (Kinsey Millhone Mysteries (Paperback)),Exclusive,All That Remains (Kay Scarpetta Mysteries (Paperback)),Cruel &amp; Unusual (Kay Scarpetta Mysteries (Paperback)),Hide &amp; Seek
The Color Purple,Wuthering Heights,Schindler's List,The Prince of Tides,Jacob Have I Loved,Nightmares &amp; Dreamscapes
The Color of Water: A Black Man's Tribute to His White Mother,Saint Maybe,Jemima J: A Novel About Ugly Ducklings and Swans,Blue Diary,The Lovely Bones: A Novel,To Kill a Mockingbird
The Copper Beech,Evening Class,The Bourne Ultimatum,Cold Sassy Tree,Harvest,Colony
The Cradle Will Fall,Exclusive,Eyes of a Child,Before I Say Good-Bye,While My Pretty One Sleeps,Remember Me
The Crimson Petal and the White,Fortune's Rocks : A Novel,The Hours : A Novel,A Civil Action,Breathing Lessons,The Blind Assassin
The Da Vinci Code,Angels &amp; Demons,Touching Evil,Saving Faith,The Sweet Potato Queens' Book of Love,Middlesex: A Novel
The Dark Half,The Tommyknockers,Gerald's Game,Four Past Midnight,Skeleton Crew,Insomnia
The Deep End of the Ocean,Along Came a Spider (Alex Cross Novels),The Pull of the Moon,"All the Pretty Horses (The Border Trilogy, Vol 1)",The Shipping News : A Novel,Hannibal
The Devil Wears Prada : A Novel,Shopaholic Takes Manhattan (Summer Display Opportunity),Confessions of a Shopaholic (Summer Display Opportunity),The Nanny Diaries: A Novel,The Hours : A Novel,Wanderlust
The Diary of Ellen Rimbauer: My Life at Rose Red,The Regulators,Nightmares &amp; Dreamscapes,It,Foucault's Pendulum,The Tommyknockers
The Divine Secrets of the Ya-Ya Sisterhood: A Novel,The Shipping News : A Novel,Four To Score (A Stephanie Plum Novel),The Nanny Diaries: A Novel,Tears of the Giraffe (No.1 Ladies Detective Agency),B Is for Burglar (Kinsey Millhone Mysteries (Paperback))
The Dogs of Babel (Today Show Book Club #12),The Hours: A Novel,Chosen Prey,The Jester,"Like Water for Chocolate: A Novel in Monthly Installments With Recipes, Romances and Home Remedies",The Last Time They Met : A Novel
The Door to December,The Bad Place,Rules of Prey,Strangers,The Lottery Winner : Alvirah And Willy Stories,Stillwatch
"The Drawing of the Three (The Dark Tower, Book 2)","The Gunslinger (The Dark Tower, Book 1)","Wizard and Glass (The Dark Tower, Book 4)",The Tommyknockers,Four Past Midnight,Desperation
The Edge,Cry Wolf,Mind Prey,Hemlock Bay,The Switch,Night Sins
The Eight,Year of Wonders,Night Sins,The Alibi,No Safe Place,The Other Boleyn Girl
The Empty Chair,P Is for Peril,Sudden Prey,The Summons,Unnatural Exposure,D Is for Deadbeat (Kinsey Millhone Mysteries (Paperback))
The English Patient,The God of Small Things,The Hours : A Novel,The Celestine Prophecy (Celestine Prophecy),The Cider House Rules,Pride and Prejudice
The Eyre Affair: A Novel,Confessions of an Ugly Stepsister : A Novel,"The Amber Spyglass (His Dark Materials, Book 3)",The Bonfire of the Vanities,"The Bad Beginning (A Series of Unfortunate Events, Book 1)","The Subtle Knife (His Dark Materials, Book 2)"
The Face of Deception,"Loves Music, Loves to Dance",Moonlight Becomes You,You Belong To Me,Body of Lies,Night Sins
"The Fellowship of the Ring (The Lord of the Rings, Part 1)","The Two Towers (The Lord of the Rings, Part 2)","The Return of the King (The Lord of the Rings, Part 3)",Harry Potter and the Prisoner of Azkaban (Book 3),Harry Potter and the Goblet of Fire (Book 4),Harry Potter and the Chamber of Secrets (Book 2)
The Firm,The Rainmaker,The Pelican Brief,The Chamber,The Client,A Time to Kill
The First Counsel,Debt of Honor (Jack Ryan Novels),Exclusive,The Killing Game: Only One Can Win...and the Loser Dies,The Alibi,Don't Stand Too Close to a Naked Man
The Five People You Meet in Heaven,"Tuesdays with Morrie: An Old Man, a Young Man, and Life's Greatest Lesson",In Her Shoes : A Novel,The Woman Next Door,The Notebook,Nights in Rodanthe
The Fourth Hand,A Prayer for Owen Meany,The Hours : A Novel,Good Omens,The Burden of Proof,I Know This Much Is True (Oprah's Book Club)
The General's Daughter,Four Blind Mice,Fat Tuesday,Pop Goes the Weasel,Rainbow Six,Hearts in Atlantis
The Genesis Code,The Simple Truth,A Civil Action,The Burden of Proof,Last Chance Saloon,Exclusive
